full_text;clean_text
ANJR ANJR PARANORMAL LOVE DIBAWAIN COOOOO #ENHYPEN #ENCHELLA2025;anjr paranormal love dibawain cooooo enhypen enchella
GANTENG BANGET KACAUUUU #ENCHELLA2025 #JAKE #ENHYPEN_JAKE https://t.co/h0kMZA8Vho;ganteng banget kacauuuu enchella jake enhypenjake
MAMPUSSSS BENERANN JIDATANNN COKK GANTENG BGTT #ENCHELLA2025;mampussss benerann jidatannn cokk ganteng bgtt enchella
PELAN PELAN BANGGGG #ENCHELLA2025;pelan bangggg enchella
OMG SIM JAEHYUN APAKA GWAPO!! ENHYPEN VAMPS UP COACHELLA #ENHYPENinCoachella #ENCHELLA2025 #COACHELLA https://t.co/SeQ76XjOQ1;omg sim jaehyun apaka gwapo enhypen vamps up coachella enhypenincoachella enchella
Outfit for Coachella todayy sangat² keren sekali #ENCHELLA2025 #ENHYPEN;outfit for coachella todayy keren enchella enhypen
anjir heeseung cantik bgt #ENHYPEN #Coachella2025 #ENCHELLA2025;anjir heeseung cantik bgt enhypen coachella enchella
HEHHHH DIEMMMM COWO GUA KEREN BANGET GILAAAAA #ENHYPEN #ENCHELLA2025;hehhhh diemmmm cowo gua keren banget gilaaaaa enhypen enchella
Gabisa bgt sm outfit plus rambut di coachella week ini #ENCHELLA2025;gabisa bgt sm outfit plus rambut coachella week enchella
yang ulang tahun hari ini menyala banget di coachella #ENCHELLA2025;ulang menyala banget coachella enchella
NISHIMURA RIKI BISA STOP JADI BIAS WRECKER SEMUA ORANG GAK??????????!!!!!!!!! #ENCHELLA2025;nishimura riki stop bias wrecker orang gak enchella
GAKULIAT LIAT SUNGHOON JIDATAN ENHYPEN VAMPS UP COACHELLA #ENHYPENinCoachella #ENCHELLA2025 #COACHELLA;gakuliat liat sunghoon jidatan enhypen vamps up coachella enhypenincoachella enchella
KERENN GACOR SEMUAAA #ENHYPEN #ENCHELLA2025;kerenn gacor semuaaa enhypen enchella
GILAAA JAKE SUNGHOON CAKEP BANGET #ENCHELLA2025;gilaaa jake sunghoon cakep banget enchella
GILA GILA DC BREAK ENHA KEREN BGT ANJ GILAA #ENCHELLA2025;gila dc break enha keren bgt anj gilaa enchella
ulol kuhang kuha ako ni sunghoon HJAKHWJAH TEH I LOVE U ENHYPEN VAMPS UP COACHELLA #ENCHELLA2025 #ENHYPEN #COACHELLA2025;ulol kuhang kuha ako ni sunghoon hjakhwjah teh i love u enhypen vamps up coachella enchella
GW MUNTAHHHHHHH GANTENG BANGET BANGSATTTTTTTTTTT #ENCHELLA2025;gw muntahhhhhhh ganteng banget bangsattttttttttt enchella
Beteee bangettt gak bisa TERIAKKK2 krna ada orang rumah #ENCHELLA2025 #Coachella2025 #ENHYPEN;beteee bangettt gak teriakkk krna orang rumah enchella coachella enhypen
outfitnya kece bgt gokilll #ENCHELLA2025 #ENHYPEN;outfitnya kece bgt gokilll enchella enhypen
GULA SUKAK BANGET OUTFIT HARI INIII #ENCHELLA2025;gula sukak banget outfit iniii enchella
TOLONGGG JAYYYYY GAKUATT #ENCHELLA2025;tolonggg jayyyyy gakuatt enchella
WOI LIAT GK HEESEUNG PAS BLESSED-CURSED NURUNIN MIC DIA TEUS EMG G ADA SUARA WOOOOOO HATERSSS KEPANASAN LIAT INI ENHYPEN VAMPS UP COACHELLA #ENHYPENinCoachella #ENCHELLA2025 #COACHELLA;woi liat gk heeseung pas blessedcursed nurunin mic teus emg g suara woooooo hatersss kepanasan enhypen vamps up coachella enhypenincoachella enchella
WOI INI MIRIP BGT MINGYU KOCAKSUNOO ENHYPEN VAMPS UP COACHELLA #ENHYPENinCoachella #ENCHELLA2025 #COACHELLA https://t.co/OUf5H6Hu5H;woi bgt mingyu kocaksunoo enhypen vamps up coachella enhypenincoachella enchella
@heegirIfriend HEESEUNG #ENHYPEN #Coachella2025 #ENCHELLA2025;heeseung enhypen coachella enchella
Semoga juga ada stage jay gitaran ENHYPEN VAMPS UP COACHELLA #ENHYPENinCoachella #ENCHELLA2025 #COACHELLA;semoga stage jay gitaran enhypen vamps up coachella enhypenincoachella enchella
ENHYPEN CARALHOOOOOOOOOOOO #ENHYPEN #ENCHELLA2025 #Coachella2025;enhypen caralhoooooooooooo enchella coachella
Aduhh ini SIAPA YANG KUTANGAN YAK?!! #ENCHELLA2025 #ENHYPEN https://t.co/GkAtkoSnht;aduhh kutangan yak enchella enhypen
@moonandenhypen YAALLAH KUAT ENGGK YA YA ALLAH #ENHYPEN #ENCHELLA #ENCHELLA2025 https://t.co/1VdSDEUUg5;yaallah kuat enggk ya allah enhypen enchella
BISMILLAHIRRAHMANIRRAHIM SEMOGA LANCAR WEEKS 2 #ENHYPEN #ENCHELLA2025;bismillahirrahmanirrahim semoga lancar weeks enhypen enchella
MAMAAAA MAUU NANGISS AAAAAAAAA #ENHYPEN #ENCHELLA #ENCHELLA2025;mamaaaa mauu nangiss aaaaaaaaa enhypen enchella
3 menit lagi plis #ENCHELLA2025 #ENCHELLA;menit plis enchella
YAALLAH seriusan enhypen yang tampil gua yang DEGDEGAN cuyy apa kabar enhypen yak huaaaa FIGHTING YAA ENHYPEN #ENHYPEN #ENCHELLA #ENCHELLA2025 https://t.co/n9xFdpHX7t;yaallah seriusan enhypen tampil gua degdegan cuyy kabar yak huaaaa fighting yaa enchella
Degdegan bgtt #ENCHELLA #ENCHELLA2025 #ENHYPEN #SUNOO_SpiceUp_Coachella #SUNOO #SUNOOCHELLA;degdegan bgtt enchella enhypen sunoospiceupcoachella sunoo sunoochella
ENHYPEN SIAP MENGGUNCANG PANGGUNG COACHELLA ️‍️‍ ENHYPEN VAMPS UP COACHELLA #ENHYPENinCoachella #ENCHELLA2025 #COACHELLA https://t.co/wdAql87pEC;enhypen mengguncang panggung coachella vamps up enhypenincoachella enchella
Ini baru tangan loh tpi udh ganteng bngtt️‍️‍ #ENCHELLA #ENCHELLA2025 #ENHYPEN https://t.co/fmqr1VmhXx;tangan loh tpi udh ganteng bngtt enchella enhypen
@__ni_ki @ENHYPEN @ENHYPEN_members Q FOTO BOA KAHWKWBSSKSD VAMPIRES IN THE DESERT ENHYPEN VAMPS UP COACHELLA #ENCHELLA2025 #COACHELLA2025 #ENCHELLA #ENHYPEN;q foto boa kahwkwbssksd vampires in the desert enhypen vamps up coachella enchella
Abis WO ini lagi pegel pegelnya tapi semangat tetap MENYALAAA #ENCHELLA2025 #ENHYPEN #Coachella2025 #JAYatCOACHELLA;abis wo pegel pegelnya semangat menyalaaa enchella enhypen coachella jayatcoachella
Itu yg pake sarung tangan niki sama heesung?? Kalo iya damnnn Ready for #ENHYPEN #ENCHELLA2025 https://t.co/xYGu6LJAwU;yg pake sarung tangan niki heesung kalo iya damnnn ready for enhypen enchella
Damn merinding dikit gw ENHYPEN VAMPS UP COACHELLA #ENHYPENinCoachella #ENCHELLA2025 #COACHELLA https://t.co/v4fwW8tJ3x;damn merinding dikit gw enhypen vamps up coachella enhypenincoachella enchella
gais kalau bisa streamnya dua device ya sama yang di channel ha sister jugaa biar gacorr viewsnyaa #ENCHELLA #ENCHELLA2025 #Coachella2025 #ENHYPEN;gais streamnya device ya channel ha sister jugaa biar gacorr viewsnyaa enchella coachella enhypen
aaa gue degdegan SEMANGAT SAYANG-SAYANGKU!! Ayo tunjukin ke semuanya betapa kerennya kalian ENHYPEN VAMPS UP COACHELLA #ENHYPENinCoachella #ENCHELLA2025 #COACHELLA https://t.co/LsmZvAegem;aaa gue degdegan semangat sayangsayangku ayo tunjukin betapa kerennya enhypen vamps up coachella enhypenincoachella enchella
ROCK THE SAHARA!!!! #ENHYPEN #ENCHELLA #ENCHELLA2025 https://t.co/jXCF42rov0;rock the sahara enhypen enchella
woww outfit nya mereka kerenn bgt tebak yg merah siapaa #ENHYPEN #ENCHELLA #ENCHELLA2025 https://t.co/dP6JVk11b0;woww outfit nya kerenn bgt tebak yg merah siapaa enhypen enchella
NANGISS BANGET ENHYPEN YANG TAMPIL AK YANG DEGDEGAN OMGAAAA FIGHTING ENHYPEN #ENHYPEN #ENCHELLA #ENCHELLA2025 https://t.co/nXnsLcpliF;nangiss banget enhypen tampil ak degdegan omgaaaa fighting enchella
itu outfit mereka buat hari ini kah #ENHYPEN #Coachella #ENCHELLA2025 https://t.co/jTtvgFp9ZR;outfit kah enhypen coachella enchella
@jaehmyu Ni-ki #ENHYPEN #ENCHELLA2025 #Coachella2025;niki enhypen enchella coachella
kira-kira akan ada gebrakan apa ya? aduh gak sabar bangetttt #ENCHELLA #ENHYPEN #ENCHELLA2025;kirakira gebrakan ya aduh gak sabar bangetttt enchella enhypen
SAHARA! #ENCHELLA #ENCHELLA2025 @ENHYPEN https://t.co/LiSZ11CoNW;sahara enchella
AKUU SIAP HARI INI ASKKZLSPWPJSKKQLOQOWJAMQKKWJW FIGHTING NAIKIN HT NYA ENGENEE BOUND BY FATE WITH JAY AND ENCHELLA #WeavingOurFateswithJAY #낭만깜고_락스타_종성데이 #HappyBirthJAY #ENHYPEN_JAY #ENHYPEN #ENCHELLA2025 #ENCHELLA @ENHYPEN_members https://t.co/mpE7xbXdnn;akuu askkzlspwpjskkqloqowjamqkkwjw fighting naikin ht nya engenee bound by fate with jay and enchella weavingourfateswithjay happybirthjay enhypenjay enhypen
@effyy1009 Sunjake #ENCHELLA #ENCHELLA2025 #ENHYPEN https://t.co/CcymYdcL6M;sunjake enchella enhypen
#ENCHELLA #ENCHELLA2025 sumpah jadwal gw tabrakan terus enchella https://t.co/eksFM8FQPz;enchella sumpah jadwal gw tabrakan
Segera taayang Nonton ENHYPEN di Coachella 2025 weekend 2 pada 20 April: Jadwal tampil setlist lagu dan link streaming #ENHYPEN #Coachella #Coachella2025 #ENCHELLA #ENCHELLA2025 https://t.co/0CiHEYiLjV;taayang nonton enhypen coachella weekend april jadwal tampil setlist lagu link streaming enchella
kurang dari sejam lagi ‍‍‍ #ENHYPEN #Coachella #ENCHELLA2025;sejam enhypen coachella enchella
ok bahkan di week 2 pun ak tidak bisa menonton #ENCHELLA2025 sedih bgt dhhhhh;ok week ak menonton enchella sedih bgt dhhhhh
Menunggu.... Satu jam lagi https://t.co/uzN80zLCI1 Weekend nonton coachella jangan lupa cemilan nya haha #ENCHELLA #ENCHELLA2025 https://t.co/g9nxywso9P;menunggu jam weekend nonton coachella lupa cemilan nya haha enchella
ENHYPEN SEM CAMISA ENHYPEN SEM CAMISA ENHYPEN SEM CAMISA ENHYPEN SEM CAMISA ENHYPEN SEM CAMISA ENHYPEN SEM CAMISA ENHYPEN SEM CAMISA ENHYPEN SEM CAMISA ENHYPEN SEM CAMISA ENHYPEN SEM CAMISA ENHYPEN SEM CAMISA ENHYPEN SEM CAMISA #ENCHELLA2025 #COACHELLA2025 #ENCHELLA #ENHYPEN https://t.co/W4KRCPXTAK;enhypen sem camisa enchella coachella
ENHYPEN SEM CAMISA ENHYPEN SEM CAMISA ENHYPEN SEM CAMISA ENHYPEN SEM CAMISA ENHYPEN SEM CAMISA ENHYPEN SEM CAMISA ENHYPEN SEM CAMISA ENHYPEN SEM CAMISA ENHYPEN SEM CAMISA ENHYPEN SEM CAMISA ENHYPEN SEM CAMISA ENHYPEN SEM CAMISA #ENCHELLA2025 #COACHELLA2025 #ENCHELLA #ENHYPEN https://t.co/08YyTN1vuU;enhypen sem camisa enchella coachella
ENHYPEN SEM CAMISA ENHYPEN SEM CAMISA ENHYPEN SEM CAMISA ENHYPEN SEM CAMISA ENHYPEN SEM CAMISA ENHYPEN SEM CAMISA ENHYPEN SEM CAMISA ENHYPEN SEM CAMISA ENHYPEN SEM CAMISA ENHYPEN SEM CAMISA ENHYPEN SEM CAMISA ENHYPEN SEM CAMISA #ENCHELLA2025 #COACHELLA2025 #ENCHELLA #ENHYPEN https://t.co/b3r9HAtq0g;enhypen sem camisa enchella coachella
agensi gila bkn promosiin dr akun coachella nya langsung knp dia tbtb ngeshare link ytb dr ch nya enha sendiri? dipikir ga bakal ngambil data viewers kali. pls ya temen² nontonnya diytb coachella lgsg sakit hati bgt ini kl ada yg nntn di link nya belift #ENCHELLA #ENCHELLA2025 https://t.co/NfFO0frOhv;agensi gila bkn promosiin dr akun coachella nya langsung knp tbtb ngeshare link ytb ch enha dipikir ga ngambil data viewers kali pls ya temen nontonnya diytb lgsg sakit hati bgt kl yg nntn belift enchella
GUYS TOLONG YA NONTON NYA DI YOUTUBE NYA COACHELLA LANGSUNG JANGAN LINK DARI BELIFT #ENCHELLA #ENCHELLA2025 #ENHYPEN https://t.co/bvHxPXmTzE;guys tolong ya nonton nya youtube coachella langsung link belift enchella enhypen
@jayberrycute ORANGE FLOWER #ENCHELLA #ENCHELLA2025 #ENHYPEN https://t.co/O82lUxPu4E;orange flower enchella enhypen
@findcamie ni-ki #ENCHELLA #ENCHELLA2025 #COACHELLA2025 #ENHYPEN;niki enchella coachella enhypen
@findcamie heeseung #ENCHELLA #ENCHELLA2025 #COACHELLA2025 #ENHYPEN;heeseung enchella coachella enhypen
@findcamie ni-ki #ENCHELLA #ENCHELLA2025 #COACHELLA2025 #ENHYPEN;niki enchella coachella enhypen
HBD JAYYYYYYYYYY #ENCHELLA #ENCHELLA2025 #ENHYPEN;hbd jayyyyyyyyyy enchella enhypen
WYEYEYEYEYEYEYEYEYEYYEYEYE #ENCHELLA #ENCHELLA2025 #ENHYPEN;wyeyeyeyeyeyeyeyeyeyyeyeye enchella enhypen
Setlist nya bakal sama kek weekend 1 apa beda ya? Plss beda plsssss #ENCHELLA #ENHYPEN #ENCHELLA2025 https://t.co/rPAeXkSyoO;setlist nya kek weekend beda ya plss plsssss enchella enhypen
Siap mereog dengan lepas setelah sebelumnya hanya tertahan karena barengan sama forum lainn #ENCHELLA #ENCHELLA2025 #ENHYPEN https://t.co/1Hr2qtkbVQ;mereog lepas tertahan barengan forum lainn enchella enhypen
Celamat pagih mblepp ️ Para cimol bojot udh nangkring siap liat perform para bapack2ny #ENCHELLA #ENCHELLA2025 #ENHYPEN #Coachella2025Enhypen https://t.co/m7FTSJXHoO;celamat pagih mblepp cimol bojot udh nangkring liat perform bapackny enchella enhypen coachellaenhypen
Deg2an bngt euyyyy letchugaurrr enchella #ENCHELLA #ENCHELLA2025 #ENHYPEN https://t.co/90nkcwcGu3;degan bngt euyyyy letchugaurrr enchella enhypen
@NI_KISTUDIO 5. sunghoon jay #ENCHELLA #ENHYPEN #ENCHELLA2025;sunghoon jay enchella enhypen
Kalo jay hari ini gitaran aku bakalan nonton iland 2x #ENCHELLA #ENCHELLA2025 #ENHYPEN;kalo jay gitaran nonton iland x enchella enhypen
SUMPAH DEGDEGAN BGT #ENCHELLA #ENCHELLA2025 #ENHYPEN;sumpah degdegan bgt enchella enhypen
kiwi #Coachella2025 #ENCHELLA2025 #ENHYPEN;kiwi coachella enchella enhypen
JAYY GITARAN AAMIIN #ENCHELLA #ENCHELLA2025 #ENHYPEN;jayy gitaran aamiin enchella enhypen
Hari ini setlist nya sama kaya kemarin gk ya #ENCHELLA #ENCHELLA2025 #ENHYPEN;setlist nya kaya kemarin gk ya enchella enhypen
@silentstarsnk2 aaa terharu bgt #ENCHELLA #ENCHELLA2025 #ENHYPEN;aaa terharu bgt enchella enhypen
borjuis juga diliat liat #ENHYPEN #ENCHELLA #ENCHELLA2025 https://t.co/jOH7NY77Ab;borjuis diliat liat enhypen enchella
Let's go #ENHYPEN #ENCHELLA2025 #ENCHELLA jdiwngzjsnwhsik;lets go enhypen enchella jdiwngzjsnwhsik
@divengenes KARNA SEKARANG MOONSTRUCK LEBIH SERING DIBAWAIN JDI CHACONNE AJA #ENCHELLA #ENCHELLA2025 #ENHYPEN;karna moonstruck dibawain jdi chaconne aja enchella enhypen
@divengenes AAAA SUSAH BGT INI #ENCHELLA #ENCHELLA2025 #ENHYPEN;aaaa susah bgt enchella enhypen
@leftside_riki sudah pasti #ENCHELLA #ENCHELLA2025 #ENHYPEN;enchella enhypen
@shantloveshs pliss bgt jay gitaran #ENCHELLA #ENCHELLA2025 #ENHYPEN;pliss bgt jay gitaran enchella enhypen
@ENHYPEN_Charts aaaa gk sabar #ENCHELLA #ENCHELLA2025 #ENHYPEN;aaaa gk sabar enchella enhypen
@hoonikiz cakep bgt ihhh #ENCHELLA #ENCHELLA2025 #ENHYPEN;cakep bgt ihhh enchella enhypen
@enhypenupdates aaa gemes bgt #ENCHELLA #ENCHELLA2025 #ENHYPEN;aaa gemes bgt enchella enhypen
@NI_KISTUDIO 5. Ni-ki or Sunghoon #ENCHELLA2025 #ENCHELLA #Coachella2025;niki or sunghoon enchella coachella
Abis begawe blm mandi wkwk cuss mandi abis ini kita stream enchella berharap ada solo perform jay di ultahnya yah #ENHYPEN #ENHYPEN_JAY #ENCHELLA2025 #enchella;abis begawe blm mandi wkwk cuss stream enchella berharap solo perform jay ultahnya yah enhypen enhypenjay
semu!!! #ENHYPEN #ENCHELLA2025 #COACHELLA2025;semu enhypen enchella coachella
@ihsheeboy sunghooon #ENCHELLA #ENCHELLA2025 #ENHYPEN;sunghooon enchella enhypen
semoga masih ada blockbuster semoga ada karma #ENHYPEN #Coachella #ENCHELLA2025;semoga blockbuster karma enhypen coachella enchella
@jaehmyu ni-ki #ENCHELLA2025 #Coachella2025 #ENHYPEN #ENCHELLA;niki enchella coachella enhypen
@jaehmyu heeseung #ENCHELLA2025 #Coachella2025 #ENHYPEN #ENCHELLA;heeseung enchella coachella enhypen
HEESEUNG ️‍️‍️‍ #ENCHELLA2025 #Coachella2025 #ENHYPEN https://t.co/n2q006nneK;heeseung enchella coachella enhypen
@forenhaz #ENHYPEN #ENCHELLA2025 #COCHELLA2025 Orange flower;enhypen enchella cochella orange flower
@Sunghson Menyala anakku #ENCHELLA2025;menyala anakku enchella
#ENCHELLA2025 besok ada shout out gk ya sama one in a billion;enchella besok shout out gk ya one in a billion
@ethanolees Yg penting #ENCHELLA2025 dik ;yg enchella dik
Bismillah Jake sleeveless di Coachella w2 ‍️ #Coachella2025 #ENCHELLA2025 #ENHYPEN_JAKE;bismillah jake sleeveless coachella w enchella enhypenjake
@sstuvwxyzss cowok gue gitu lohh #SUNOO #ENCHELLA2025 #Coachella2025;cowok gue gitu lohh sunoo enchella coachella
@yayymie indah bgt.... #SUNOO #ENCHELLA2025 #Coachella2025;indah bgt sunoo enchella coachella
Jakeuuu #ENCHELLA #ENCHELLA2025 #ENHYPEN #Coachella2025;jakeuuu enchella enhypen coachella
Bro sorry heeseungh #HEESEUNG #coachella #ENHYPEN #ENCHELLA2025 https://t.co/B5LU1Dvunw;bro sorry heeseungh heeseung coachella enhypen enchella
JUNGWONN I'M READY FOR UR GEBRAKAN ️‍ kalo uwon buka bukaan kira' kayang di tengah jalan tumac ga? eh.... #ENHYPEN #ENCHELLA #ENCHELLA2025;jungwonn im ready for ur gebrakan kalo uwon buka bukaan kayang jalan tumac ga eh enhypen enchella
guys tp mulesnya masih ada pdhl ini week 2 #ENHYPEN #ENCHELLA2025 #ENCHELLA #COACHELLA2025;guys tp mulesnya pdhl week enhypen enchella coachella
@pparkljongseong Happy Birthday Jay! Makasih ya udah bercita-cita jadi orang keren dan memutuskan jadi idol. Things I love about Jay tuh semuanya yang ada di dia aku suka. Suaranya senyumnya ekspresi nya tingkah anehnya wavy finger nya jokes nya dia. #ENHYPEN #ENCHELLA #ENCHELLA2025 https://t.co/3X8wGfWHFu;happy birthday jay makasih ya udah bercitacita orang keren memutuskan idol things i love about tuh suka suaranya senyumnya ekspresi nya tingkah anehnya wavy finger jokes enhypen enchella
Ayyyoo #ENCHELLA #ENCHELLA2025 #ENHYPEN;ayyyoo enchella enhypen
Engina nonton di Coachella's official YouTube channel on Apr 20 Sunday 11.35 WIB ⏰ 10.35 - 11.20 WIB | 11.35 - 12.20 WITA | 12.35 - 13.20 WIT jgn pake link yg di up bela gajetot #ENCHELLA2025 #COACHELLA #ENHYPEN;engina nonton coachellas official youtube channel on apr sunday wib wita wit jgn pake link yg up bela gajetot enchella coachella enhypen
@AboutMusicYT my vanpaia ENHYPEN #NI_KI #ENCHELLA2025 https://t.co/RoMb5zDTwE;my vanpaia enhypen niki enchella
BESOK WOYY BESOKKKKK CAN T WAITTT #ENHYPEN #ENCHELLA #ENCHELLA2025 https://t.co/7AHvR2TbdI;besok woyy besokkkkk can t waittt enhypen enchella
#ENCHELLA2025 day 1 cabang jaktim https://t.co/uhoxDdXK15;enchella day cabang jaktim
Jaeyunie #ENCHELLA #ENCHELLA2025 #COACHELLA2025 #ENHYPEN;jaeyunie enchella coachella enhypen
UEBSYEBWUWHEUSHEUSBS ENHYPEN #ENHYPEN #ENCHELLA #ENCHELLA2025;uebsyebwuwheusheusbs enhypen enchella
Gw brharap bgt pls setlist week 2 isinya full vampire songs vibesnya .Gtw knp kepengen itu gitu sama lagu² di album memorabilia or darkblood mereka dikeluarin So you guys Inget kn break dance one in a billion tuh bener² ARGGHH BGT #ENCHELLA2025 #ENHYPEN #Coachella2025 https://t.co/b0KE9JZlSC;gw brharap bgt pls setlist week isinya full vampire songs vibesnya gtw knp kepengen gitu lagu album memorabilia or darkblood dikeluarin so you guys inget kn break dance one in a billion tuh bener argghh enchella enhypen coachella
Baik-baik ibu dan anak-anak nya ini yaa #ENCHELLA #ENCHELLA2025 #ENHYPEN https://t.co/rkIqi4S3za;baikbaik anakanak nya yaa enchella enhypen
️Dresscode jong's the rockstars️ Haiii engenee Berpakaian lah semenarik dan sekeren mungkin karena akan ada hadiah speciall untuk pemenang DC terbaik dan terkerenn lohh See you in event engene #ENHYPEN_JAY #fypage #ENGENE #ENHYPEN #4u #birthday #ENCHELLA2025 https://t.co/bK1snxf6It;dresscode jongs the rockstars haiii engenee berpakaian semenarik sekeren hadiah speciall pemenang dc terbaik terkerenn lohh see you in event engene enhypenjay fypage enhypen u birthday enchella
@heeyunkiarchive Gaaaaaha #ENHYPEN #ENCHELLA #COCHELLA2025 #ENCHELLA2025;gaaaaaha enhypen enchella cochella
️‍Ni-ki️‍ #ENCHELLA #ENCHELLA2025 #ENHYPEN @ENHYPEN_members https://t.co/e5K5HCDYql;niki enchella enhypen
Siap gk siap kumpullah gk mirip tp yaudhlah ya‍ #HEESEUNG #HEESEUNG_ENHYPEN #희승 #이희승 #엔하이픈 #ENHYPEN #ENCHELLA2025 #Coachella2025 https://t.co/r7cBNkz2sk;gk kumpullah tp yaudhlah ya heeseung heeseungenhypen enhypen enchella coachella
@Jzn1tu @EnhypeCups Sana Umuwi pls! #ENHYPEN #ENCHELLA2025 #ENHYPEN_JAY https://t.co/Zs69gUNZyI;umuwi pls enhypen enchella enhypenjay
WWD Coachella tebak ketua ? #엔하이픈 #ENHYPEN #JUNGWON #HEESEUNG #JAY #JAKE #SUNGHOON #SUNOO #NI_KI #Coachella2025 #ENCHELLA2025 https://t.co/tuI3363NkG;wwd coachella tebak ketua enhypen jungwon heeseung jay jake sunghoon sunoo niki enchella
#ENCHELLA WK1 BABY!! #ENCHELLA2025 #ENHYPEN @ENHYPEN_members https://t.co/ILeAZWP9EK;enchella wk baby enhypen
100% real toh #ENCHELLA #ENCHELLA2025 #ENHYPEN;real enchella enhypen
Sunghoon sweet venom fancam #sunghoon #ENHYPEN #ENCHELLA2025 #Coachella2025 https://t.co/OiGShf1yOs;sunghoon sweet venom fancam enhypen enchella coachella
Trending di youtube Indonesia : #17 Enhypen - XO #23 Enhypen - Intro+Blockbuster #ENHYPEN #ENCHELLA #ENCHELLA2025 #Coachella2025 https://t.co/xRHfItohO9;trending youtube indonesia enhypen xo introblockbuster enchella coachella
siapa coba yg gak salting ditatap begituu hee??????? #HEESEUNG #ENHYPEN #ENCHELLA #ENCHELLA2025 https://t.co/NZLqwTvwl5;coba yg gak salting ditatap begituu hee heeseung enhypen enchella
0412 Niki in the desert #NI_KI #니키 #ニキ #西村力 #엔하이픈 #ENHYPEN #Coachella2025 #ENCHELLA2025 https://t.co/f4m3qalr9Y;niki in the desert enhypen coachella enchella
@urmyjongstar MAUU KAA @juythemeng #COACHELLA2025 #Coachella #ENHYPEN #ENCHELLA2025;mauu kaa coachella enhypen enchella
Happy birthday soon for you my love Bangga bgt aku pls sm kalian Dan ini jadi kado terindah kamu yaa sayang bisa tampil di panggung besar impianmu dari dulu I love you always jay.. I love enhypen too.. #ENHYPEN_JAY #ENHYPEN #Coachella2025 #ENCHELLA2025;happy birthday soon for you my love bangga bgt pls sm kado terindah yaa sayang tampil panggung impianmu i always jay enhypen too enhypenjay coachella enchella
k-kok dia mirip bebek banget ya #ENCHELLA #ENHYPEN #NI_KI #ENCHELLA2025 https://t.co/eZu1DA8yEr;kkok bebek banget ya enchella enhypen niki
@heya2_mew @tsukishimYa bener bener terharuu bngtt.. mreka smpe coachella dan bnyak yg apresiasi mreka disituu emng enha bener bener real talented izin ikutan ya kaa and wmll #ENCHELLA #ENCHELLA2025;bener terharuu bngtt mreka smpe coachella bnyak yg apresiasi disituu emng enha real talented izin ikutan ya kaa and wmll enchella
batak #ENCHELLA2025 #COACHELLA2025 #ENHYPEN;batak enchella coachella enhypen
@enhapopbase MALAYSIA🇲🇾 #ENCHELLA #ENCHELLA2025;malaysia enchella
MAH SHAYLAHH!!!! #ENCHELLA #ENCHELLA #ENCHELLA2025;mah shaylahh enchella
Siapaa sangkaa beliau penboi #ENHYPENinCoachella_D1 #ENCHELLA2025 #Coachella2025 https://t.co/uzkfjKgI8u;siapaa sangkaa beliau penboi enhypenincoachellad enchella coachella
@lheesoftie BANGGA BANGETT URII VAMPIRE️‍️‍#ENCHELLA #ENCHELLA2025 #ENHYPEN #COACHELLA2025;bangga bangett urii vampireenchella enchella enhypen coachella
@sungj4ke BANGGA BANGETT URII VAMPIRE️‍️‍#ENCHELLA #ENCHELLA2025 #ENHYPEN #COACHELLA2025;bangga bangett urii vampireenchella enchella enhypen coachella
@enginafess BANGGA BANGETT URII VAMPIRE️‍️‍#ENCHELLA #ENCHELLA2025 #ENHYPEN #COACHELLA2025;bangga bangett urii vampireenchella enchella enhypen coachella
@Engy_0_7 BANGGA BANGETT URII VAMPIRE️‍️‍#ENCHELLA #ENCHELLA2025 #ENHYPEN #COACHELLA2025;bangga bangett urii vampireenchella enchella enhypen coachella
@TheePopCore BANGGA BANGETT URII VAMPIRE️‍️‍#ENCHELLA #ENCHELLA2025 #ENHYPEN #COACHELLA2025;bangga bangett urii vampireenchella enchella enhypen coachella
@FORESHAD0WS BANGGA BANGETT URII VAMPIRE️‍️‍#ENCHELLA #ENCHELLA2025 #ENHYPEN #COACHELLA2025;bangga bangett urii vampireenchella enchella enhypen coachella
@enginafess Di rangkum aja yah saking bingung dan reog nya #ENCHELLA2025 #ENHYPEN #ENHYPENinCoachella https://t.co/B1jtiUDQzA;rangkum aja yah saking bingung reog nya enchella enhypen enhypenincoachella
@heya2_mew POKOKNYA ENHA IN COACHELLA LITERALLY ATE AND LEFT NO CRUUUMBSSS GNTENG GNTENG BENEERR COWO KT AHAY ️ TOP TOP AND BANGGA BNGTTT @nxt2ins_j #ENCHELLA #ENCHELLA2025 #ENHYPENinCoachella;pokoknya enha in coachella literally ate and left no cruuumbsss gnteng beneerr cowo kt ahay top bangga bngttt enchella enhypenincoachella
@rikipick DILAN YANG INI MAH AKU MAU #Coachella2025 #ENHYPEN #ENCHELLA2025;dilan mah coachella enhypen enchella
@heya2_mew Haii kaa aku mau ikut GA nya dongg enjoy your life kaa btw enchella kemaren gacorr#ENCHELLA #ENCHELLA2025 #ENHYPENinCoachella;haii kaa ga nya dongg enjoy your life btw enchella kemaren gacorrenchella enhypenincoachella
MEMANG KEREN SAYANG SAYANGKU ITUHH‍↔️‍↔️ kaget bgt temenku yg notabene non-kpop tbtb bilang ke aku kayak gitu kek WOW?!?! ENHYPEN KALIAN MEMANG KEREN BGTT BANGGA️‍️‍ dredek biasnya sapa y #ENCHELLA #ENCHELLA2025 #ENHYPEN #Coachella2025 https://t.co/888yhEKpnk;keren sayang sayangku ituhh kaget bgt temenku yg notabene nonkpop tbtb bilang kayak gitu kek wow enhypen bgtt bangga dredek biasnya sapa y enchella coachella
$spy $BTC SMSTR $SPY $QQQ $XPR $SOL SPEPE $SHIB $DOGE $AMC $GME #bbtvi #FestivalxBILLKIN #zelena #ENCHELLA2025 #SongkranCTWxFB;spy btc smstr qqq xpr sol spepe shib doge amc gme bbtvi festivalxbillkin zelena enchella songkranctwxfb
@heya2_mew izin ikutan ya kakk!! thanks for GA nya semoga slalu diberi rezeki sebanjir banjirnya wml wml @lhexhng #ENHYPEN #ENCHELLA #ENCHELLA2025 #COACHELLA2025;izin ikutan ya kakk thanks for ga nya semoga slalu rezeki sebanjir banjirnya wml enhypen enchella coachella
Saking gak ada nya yg bisa di hate dari penampilan enha kemarin makanya hatters cari cari celah ya wkwk?? Kasian bgtt mending urusin fav kalian aja gak sihh dari pada ngurusin anak anak ku #ENHYPEN #ENCHELLA2025 #ENCHELLA #VAMPIRESINTHEDESERT;saking gak nya yg hate penampilan enha kemarin hatters cari celah ya wkwk kasian bgtt mending urusin fav aja sihh ngurusin anak ku enhypen enchella vampiresinthedesert
@heya2_mew aku @glamourusnz bangga sekali bisa berada di posisi di mana menyaksikan sevenhypen perform di coachella and as always mereka tampil dengan performa yang sangat indah #ENCHELLA2025 #ENHYPEN #ENCHELLA;bangga posisi menyaksikan sevenhypen perform coachella and as always tampil performa indah enchella enhypen
temen ku bikin fan art jay keren banget buset ️‍ #JAY #JAYatCOACHELLA #ENCHELLA #ENCHELLA2025 https://t.co/6LYsN4lrkA;temen ku bikin fan art jay keren banget buset jayatcoachella enchella
NISHIMURA RIKI!! #ENHYPEN #ENCHELLA2025 #ENGENES #Ni_ki #Nishimura #Coachella2025 #fypシ https://t.co/Bi3IzQAPpg;nishimura riki enhypen enchella engenes niki coachella fyp
@heya2_mew @simryeen thanks atas ga nyaa #ENCHELLA2025 #ENCHELLA;thanks ga nyaa enchella
