full_text;clean_text
Let me explain how I feel Huhu Seneng banget #ENHYPEN #ENCHELLA #ENCHELLA2025 #Coachella2025 Kim Sunoo yang keliatan super excited dia keliatan fun banget di stage ga keliatan capek samsek nikmati bangettt. Padahal siapa sih yg ga capek dihajar 40.34 menit kann. Hebat;let me explain how i feel huhu seneng banget enhypen enchella coachella kim sunoo keliatan super excited fun stage ga capek samsek nikmati bangettt sih yg dihajar menit kann hebat
gapapa gapapa hujat aja emang klo sukses tuh harus ada aja cobaannya untuk lebih sukses️ #ENCHELLA #ENCHELLA2025 #Coachella2025;gapapa hujat aja emang klo sukses tuh cobaannya enchella coachella
Cung yg disini pd nangis terus gara² liat ENHA ? Bener² bangga bgt sihh gue kayak yg ngebesarin anak anak dari sebelom telor ILAND pecah ampe skrg Pliss sumpah gabisa berenti bilang BANGGA sama kalian @ENHYPEN_members ️‍ @ENHYPEN #ENCHELLA #Coachella2025 #ENCHELLA2025 ️‍️‍ https://t.co/TUnBWboaS6;cung yg pd nangis gara liat enha bener bangga bgt sihh gue kayak ngebesarin anak sebelom telor iland pecah ampe skrg pliss sumpah gabisa berenti bilang enchella coachella
LISA IKUT NONTON #ENCHELLA #enhypencoachella #ENCHELLA2025;lisa nonton enchella enhypencoachella
JAY KETERLALUAN BGTT GANTENG NYA #ENCHELLA #ENCHELLA2025 #enhypencoachella;jay bgtt ganteng nya enchella enhypencoachella
Tiga eks TPN OPM kembali ke pangkuan NKRI dan berkomitmen wujudkan Papua Damai. #PapuaDamai #PapuaNKRI #PapuaViral #Indonesia #MBGPapua #Coachella #ENCHELLA2025 #ParisRoubaix https://t.co/KUcXf2Na5M;eks tpn opm pangkuan nkri berkomitmen wujudkan papua damai papuadamai papuankri papuaviral indonesia mbgpapua coachella enchella parisroubaix
@heya2_mew izin ikutan ya btw thank for the GA sekeren itu penampilan mereka di coachella asli bangga banget liat usaha mereka sampe detik ini ️‍bismillah wml @vayungxz #ENHYPEN #ENCHELLA #ENCHELLA2025 #COACHELLA2025;izin ikutan ya btw thank for the ga sekeren penampilan coachella asli bangga banget liat usaha sampe detik bismillah wml enhypen enchella
Sehat sehat terus ya anak anak enhypen aku mencintai kalian +Salam cinta dari engene Indonesia️ #ENCHELLA2025 https://t.co/qNZefWnEOM;sehat ya anak enhypen mencintai salam cinta engene indonesia enchella
Btw si merah apakabar ya habis mengguncang dunia tadi malam #heeseung #LEEHEESEUNG #COACHELLA2025 #ENCHELLA #ENCHELLA2025 #ENHYPEN #ENHYPEN_HEESEUNG https://t.co/FhriEn0JKM;btw si merah apakabar ya habis mengguncang dunia malam heeseung leeheeseung coachella enchella enhypen enhypenheeseung
@abcdenhaipen lulusan pondok iland terharu bgtt #ENCHELLA2025;lulusan pondok iland terharu bgtt enchella
Huhu sobrang saya lang ng baby ko na yan #SUNOO #ENCHELLA2025;huhu sobrang lang ng baby ko na yan sunoo enchella
@heya2_mew Hai kak izin ikutan ya. Tysm wml @precioushimj #ENCHELLA #ENCHELLA2025 #ENHYPEN;hai kak izin ikutan ya tysm wml enchella enhypen
Gak sabar Minggu depan #ENCHELLA #ENCHELLA2025 #COACHELLA2025 #ENHYPEN;gak sabar minggu enchella coachella enhypen
@heeyunkipages Cakep bgt dia rambut baru #ENCHELLA2025 #COACHELLA2025 #ENHYPEN https://t.co/Z3ttUWNhM6;cakep bgt rambut enchella coachella enhypen
Sayang matchy matchy sana silang dalawa oh Pero omg Sunghoon bat ka nalipad? #Pocketz #SunWon #ENHYPEN #ENHYPEN_SUNOO #ENHYPEN_JUNGWON #ENCHELLA #ENCHELLA2025 https://t.co/ymx4gkN3vW;sayang matchy silang dalawa oh pero omg sunghoon bat ka nalipad pocketz sunwon enhypen enhypensunoo enhypenjungwon enchella
@hoonbelove INI INIII GILA HEESEUNG RAMBUT MERAH #ENCHELLA2025 #COACHELLA2025 #ENHYPEN https://t.co/iknWIU2p8k;iniii gila heeseung rambut merah enchella coachella enhypen
@hoonbelove Sukaaa sekali sama abang kecyill #ENCHELLA2025 #COACHELLA2025 #ENHYPEN https://t.co/rq22u9Yuh3;sukaaa abang kecyill enchella coachella enhypen
@heya2_mew bismillah done all rules ya kak!! thanks buat GA nya semoga aku luckyyyg @brumy #ENHYPEN #ENCHELLA #ENCHELLA2025 #COACHELLA2025;bismillah done all rules ya kak thanks ga nya semoga luckyyyg enhypen enchella coachella
tadi pagi sebelum upacara masih sempet ngeliatin fancam enchella pas upacara aku takut banget tiba tiba teriak COACHELLAAA ala ala lisa‍↔️‍↔️ #ENHYPEN #ENCHELLA2025 #enchella;pagi upacara sempet ngeliatin fancam enchella pas takut banget teriak coachellaaa ala lisa enhypen
@nattylovejay #ENCHELLA2025 #ENHYPEN #COACHELLA2025 menyalaaaaa;enchella enhypen coachella menyalaaaaa
@dankebby kecintaan banget kamu kak sama sih #SUNOO_SpiceUp_Coachella #SUNOO #ENCHELLA2025 #ENCHELLA;kecintaan banget kak sih sunoospiceupcoachella sunoo enchella
eh haters ini #enhypen udah ngga ada celah ya buat kalian jelek'in kalo masih aja ada yg jelek'in itu tandanya lu iri‼️ plsss enhypen kalian keren banget+++ let's gaurr minggu dpan lagii‍ #ENCHELLA2025 #COACHELLA2025 https://t.co/7ctwP2atQT;eh haters enhypen udah ngga celah ya jelekin kalo aja yg tandanya lu iri plsss keren banget lets gaurr minggu dpan lagii enchella coachella
@ENHYPEN_INA @coachella @Prada guys jam tampil enhypen tanggal 20 april sama kayak yang 12 april kah? CROSSING THE BORDER TO COACHELLA #ENHYPENinCoachella_D1 #ENCHELLA2025 #COACHELLA @ENHYPEN_members @ENHYPEN;guys jam tampil enhypen tanggal april kayak kah crossing the border to coachella enhypenincoachellad enchella
Sejauh 2025 #ENCHELLA2025 bakal jadi kenangan terepic tahun ini deh mereka keren bangetttt super proud Walaupun Heeseung tebar jala bgt gkpp deh gue ikhlas banget;enchella kenangan terepic deh keren bangetttt super proud heeseung tebar jala bgt gkpp gue ikhlas banget
@heya2_mew done all rules izin ikutan yaa @shinnchans #ENCHELLA #ENHYPEN #ENCHELLA2025 #COACHELLA2025;done all rules izin ikutan yaa enchella enhypen coachella
@Puma24Girl NISHIMURA RIKI #ENCHELLA #ENCHELLA2025 #COACHELLA2025 #ENHYPEN;nishimura riki enchella coachella enhypen
@jsyrwmin 1. Sunghoon 2. Ni-ki 3. Jake #ENCHELLA2025 #COACHELLA2025 #ENHYPEN;sunghoon niki jake enchella coachella enhypen
@enhypenupdates Ganteng banget #COACHELLA2025 #ENCHELLA2025 #ENHYPEN #SUNGHOON;ganteng banget coachella enchella enhypen sunghoon
@chaaasim Semoga semua yang dikerjakan lancar dan sehat #Coachella2025 #ENCHELLA2025 #ENCHELLA #ENHYPEN;semoga lancar sehat coachella enchella enhypen
Minggu depan criminal love please ‍️‍️‍️‍️‍️‍️‍️‍️‍️ #ENCHELLA #COACHELLA2025 #ENHYPEN #ENHYPENinCoachella_D1 #ENCHELLA2025;minggu criminal love please enchella coachella enhypen enhypenincoachellad
Wahh setlist kocela enha mantabbb semuaaaa manaa keren semua performnya gaada yg zonk #ENHYPEN #COACHELLA2025 #ENCHELLA2025;wahh setlist kocela enha mantabbb semuaaaa manaa keren performnya gaada yg zonk enhypen coachella enchella
Hari ini ter HEESEUNG HEESEUNG pokok eeeeeeeee pusingggg~~ menyala Red hair #COACHELLA2025 #heeseung #ENCHELLA2025;ter heeseung pokok eeeeeeeee pusingggg menyala red hair coachella enchella
Surah ul kafiron #surahulkafiron #القران_نور #quran #القران_نور_حياتي #COACHELLA2025 #ENCHELLA #deprem #キャスター #amici24 #Coachella #JENCHELLA #ENCHELLA2025 #ParisRoubaix https://t.co/xAAapzYx4H;surah ul kafiron surahulkafiron quran coachella enchella deprem amici jenchella parisroubaix
#deprem Van kayyum Amasya #ENCHELLA #キャスター #ENCHELLA2025 #ENCHELLA2025 #ParisRoubaix #สงกรานต์แซนต้ามาเดอะมอลล์;deprem van kayyum amasya enchella parisroubaix
yang mau pesan foto kaya gini start mulai 5K/Foto #joongdunkau #ENCHELLA #ENCHELLA2025 #JoongDunk https://t.co/2AzOkZsOhE;pesan foto kaya gini start kfoto joongdunkau enchella joongdunk
"WTS!! Iqiyi sharing 2 bulan cuma 10k minat? DM! CARI YANG SERIUS Payment? via gopay &amp; shopeepay #COACHELLA2025 #ENCHELLA #deprem #キャスター #amici24 #Coachella #JENCHELLA #ENCHELLA2025 #ParisRoubaix #สงกรานต์แซนต้ามาเดอะมอลล์ #GoodDay #GAGACHELLA #JENCHELLA2025 #XFestival2025";wts iqiyi sharing k minat dm cari serius payment via gopay amp shopeepay coachella enchella deprem amici jenchella parisroubaix goodday gagachella xfestival
Insta lo dorikindi #COACHELLA2025 #ENCHELLA #SongkranCTWxFB #deprem #amici24 #ฟรีนเบค #CTWSongkranFest2025 #Coachella #ENCHELLA2025 #Bitcoin #DCvsMI #RRvsRCB #CSK #dhoni #ViratKohli𓃵 #rayudu https://t.co/o7Kf09zKW1;insta lo dorikindi coachella enchella songkranctwxfb deprem amici ctwsongkranfest bitcoin dcvsmi rrvsrcb csk dhoni viratkohli rayudu
enhypen kalian selalu membanggakan #ENCHELLA2025 #ENCHELLA #COACHELLA2025 https://t.co/ZUzrR77Rav;enhypen membanggakan enchella coachella
@ENHYPEN_members MAKASIH BUAT HARI INIII IKEUUU YOU DID SOOO WELLLLL #ENCHELLA2025 #ENCHELLA #COACHELLA2025 #ENHYPEN;makasih iniii ikeuuu you did sooo welllll enchella coachella enhypen
@silliereginaa TAPI SEMUANYAAA KEEREEENN KOKKK TERIMAKASIH ATAS KERJA KERASNYA #ENHYPEN #ENCHELLA2025;semuanyaaa keereeenn kokkk terimakasih kerja kerasnya enhypen enchella
rindu itu berat kamu ga akan kuat biar aku saja #JAKE #COACHELLA2025 #ENCHELLA2025 #ENHYPEN @ENHYPEN_members https://t.co/vJzHrueW7e;rindu berat ga kuat biar jake coachella enchella enhypen
akhirnya dilan muncul ke permukaan #ENHYPEN #ENCHELLA #ENCHELLA2025 #ENHYPEN_JAKE https://t.co/ocqTVUSyL9;dilan muncul permukaan enhypen enchella enhypenjake
MAKASIH JUNGWON MAKASIH HEESEUNG MAKASIH JAY MAKASIH JAKE MAKASIH SUNGHOON MAKASIH SUNOO MAKASIH NI-KI TERIMA KASIH ENHYPEN!!!!! BANGGA BANGET SAMA KALIAANN #ENCHELLA2025 #ENCHELLA #COACHELLA2025;makasih jungwon heeseung jay jake sunghoon sunoo niki terima kasih enhypen bangga banget kaliaann enchella coachella
SOOOOO PROUUDDD YOU GUYSS!!! SAYAANGKU CINTAAKUU #ENCHELLA #COACHELLA2025 #ENHYPEN #ENCHELLA2025 https://t.co/vfoBrCBBRx;sooooo prouuddd you guyss sayaangku cintaakuu enchella coachella enhypen
Seneng bgt liat qrt dr sini semua komenannya positif dan bangga sm Jay you deserve Jay My ROCKSTAR JAY #JAYatCOACHELLA #ENCHELLA2025 #ENHYPEN #ENHYPEN_JAY;seneng bgt liat qrt dr komenannya positif bangga sm jay you deserve my rockstar jayatcoachella enchella enhypen enhypenjay
GILA IMPACTNYA EVEN ENHA UDAH TURUN DAN STAGE UDA MATI PUN MASIH PADA TERIAKIN ENHA️️ kalo gue disana gue treak ENCOREEEEEEE️️️ #ENHYPEN #ENCHELLA2025 #ENCHELLA #Coachella #COACHELLA2025 https://t.co/V5xo3LBchI;gila impactnya even enha udah turun stage uda mati teriakin kalo gue disana treak encoreeeeeee enhypen enchella coachella
Nahi#Coachella #Coachella #ENCHELLA #jeddah #ENCHELLA2025 #Coachella #deprem #大河べらぼう https://t.co/BlSZQQaJtC;nahicoachella coachella enchella jeddah deprem
@AboutMusicYT NISHIMURA RIKI #ENCHELLA2025 #ENHYPEN #NI_KI https://t.co/CEy8C80d49;nishimura riki enchella enhypen niki
@kenapaharusJake Era yang bikin aku naksir sampe sekarang Pliss semoga aku dapat baseus #ENHYPENonJimmyKimmelLive #EN_Loose #ENHYPENinCoachella_D2 #ENCHELLA2025 #COACHELLA @ENHYPEN_members @ENHYPEN https://t.co/jRiMbHOkRk;era bikin naksir sampe pliss semoga baseus enhypenonjimmykimmellive enloose enhypenincoachellad enchella coachella
si haters yang iri dengki sama enhypen pasti bingung bgt nyari letak kesalahan enhypen selama performance coachella saking gacor nya sampai bingung WKWKWK MENYALAA TUJUHH BUJANG KUU semakin di hujat semakin menyala ITU LAH ENHYPEN #ENCHELLA #COACHELLA2025 #ENCHELLA2025 https://t.co/tOztfAkRgS;si haters iri dengki enhypen bingung bgt nyari letak kesalahan performance coachella saking gacor nya wkwkwk menyalaa tujuhh bujang kuu hujat menyala enchella
jungwon nih bener kegerahan yaa #ENHYPEN #JUNGWON #엔하이픈 #정원 #ジョンウォン #ENCHELLA2025 #ENCHELLA #Coachella2025 #Coachella https://t.co/ma4S0tfK8p;jungwon nih bener kegerahan yaa enhypen enchella coachella
"@starfess pacarku &lt;3 #ENHYPEN #ENCHELLA2025 #ENCHELLA #COACHELLA2025 https://t.co/gXyJXGGrTk";pacarku lt enhypen enchella coachella
Si rambut hitam yg licin gpp kmu emg Rockstar Jay #JAYatCOACHELLA #ENHYPEN #ENCHELLA2025 #ENHYPEN_JAY;si rambut hitam yg licin gpp kmu emg rockstar jay jayatcoachella enhypen enchella enhypenjay
Adeeee ganteng banget sihh kamu hari ini keren banget!! DANCE KAMU POWERFULL PARAH! BELUM VOCALNYAA AAARRGGHH MELELEH AKUU DEEE Thank you getty images VAMPIRES IN THE DESERT #NI_KI #ENCHELLA #ENCHELLA2025 #ENHYPEN #Coachella #COACHELLA2025 https://t.co/jUdwB78Goi;adeeee ganteng banget sihh keren dance powerfull parah vocalnyaa aaarrgghh meleleh akuu deee thank you getty images vampires in the desert niki enchella enhypen coachella
Kalian lanjutin hidup duluan aja guys aku masih stuck di sini ga bisa cari jalan keluar @ENHYPEN_members #ENCHELLA2025 #ENCHELLA #ENHYPEN #Coachella2025 #heesung https://t.co/CXi4xCWEDl;lanjutin hidup duluan aja guys stuck ga cari jalan enchella enhypen coachella heesung
Enhypen bawain Moonstruck di Coachella pas banget lagi pink full moon dan ternyata Jake sendiri yang minta untuk nambahin moonstruck ke setlist!!! Gilaaaa keren dan indah bangettt Makasih Jake #JAKE #ENCHELLA #ENCHELLA2025 #ENHYPEN #Coachella #COACHELLA2025 https://t.co/F6lyCdssqs;enhypen bawain moonstruck coachella pas banget pink full moon jake nambahin setlist gilaaaa keren indah bangettt makasih enchella
"@chaaasim happy bday!! wishing all the good things for you semoga apa yg kamu impiin bisa terwujud perlahan for my beloved enha semoga makin banyak yg support &amp; suka karya mereka selalu dikelilingi orang2 baik daan sukses terus karirnya #ENCHELLA2025 #ENCHELLA #ENHYPEN #COACHELLA2025";happy bday wishing all the good things for you semoga yg impiin terwujud perlahan my beloved enha support amp suka karya dikelilingi orang daan sukses karirnya enchella enhypen coachella
@kenapaharusJake maw ikutaaaan #ENHYPENonJimmyKimmelLive #EN_Loose #ENCHELLA2025 #COACHELLA #ENHYPEN @ENHYPEN @ENHYPEN_member https://t.co/KHRnqGqBNa;maw ikutaaaan enhypenonjimmykimmellive enloose enchella coachella enhypen
Tadi pas nonton juga salfok ini pas part dazed dazed dazed jungwon jauhin mic bener2 ga kedenger backtracknya the mic is on yall #ENHYPEN #JUNGWON #엔하이픈 #정원 #ジョンウォン #ENCHELLA2025 #ENCHELLA #Coachella2025 #Coachella https://t.co/mW57gr7NN1;pas nonton salfok part dazed jungwon jauhin mic bener ga kedenger backtracknya the is on yall enhypen enchella coachella
enhypen hari ini tidur nyenyak #ENCHELLA2025 https://t.co/ALZtqTGN1Q;enhypen tidur nyenyak enchella
stan era WAKE UP IN DAY ONE alhamdulillah nyampe ke era WAKE UP IN COACHELLA lol #ENCHELLA2025 makasih yaa udh usaha kerasss @ENHYPEN_members bangga banget aku tuhh makin ksini makin gapeduli kata haters soalnya udh dikasih bukti kalau 7 cuwu ku ini berkualitas ;stan era wake up in day one alhamdulillah nyampe coachella lol enchella makasih yaa udh usaha kerasss bangga banget tuhh ksini gapeduli haters dikasih bukti cuwu ku berkualitas
ini keadaan aku selama menonton #ENCHELLA2025 modal kuota https://t.co/GGOSV14XQz;menonton enchella modal kuota
Penat #ENCHELLA2025;penat enchella
 Jadilah Kritis Bukan Memprovokasi! Bersuara itu hak kita. Tapi pastikan suara kita membangun bukan menghancurkan. Suara perubahan itu penting tapi jangan sampai salah arah.#ENCHELLA2025 #pemimpinbersihnggacawecawe #MOQEELatAGZEps132 #serangbersamaandikananang #Amorim #Jokowi https://t.co/jxzqHKooXp;kritis memprovokasi bersuara hak pastikan suara membangun menghancurkan perubahan salah arahenchella pemimpinbersihnggacawecawe moqeelatagzeps serangbersamaandikananang amorim jokowi
@freenameee izin ikutan ya kak!! thanks for GA wml wml #ENCHELLA2025 #ENCHELLA #COACHELLA2025 #ENHYPEN;izin ikutan ya kak thanks for ga wml enchella coachella enhypen
@freenameee izin ikutan GA nya di saat saat terakhir kakk omg makasii udah adain giveaway. GA SABAR BUAT MINGDEP #ENCHELLA2025 #ENCHELLA #COACHELLA2025 #ENHYPEN;izin ikutan ga nya kakk omg makasii udah adain giveaway sabar mingdep enchella coachella enhypen
@freenameee BANGGA BNGTT SAMA ENHAA #ENCHELLA2025 #ENCHELLA #COACHELLA2025 #ENHYPEN;bangga bngtt enhaa enchella coachella enhypen
@freenameee thanks for the ga kaa bangga banget sama enhypen #ENCHELLA2025 #ENCHELLA #COACHELLA2025 #ENHYPEN;thanks for the ga kaa bangga banget enhypen enchella coachella
mereka bener-bener mau ngebuktiin gak cuma bisa nyanyi tapi JAGO NYANYI DAN NGENAKIN LAGU #ENHYPEN #ENCHELLA2025 #ENCHELLA #COACHELLA2025;benerbener ngebuktiin gak nyanyi jago ngenakin lagu enhypen enchella coachella
YA ALLAH KEREN BANGETTTTTTT MANGAP MULU SEPANJANG NONTON️️️️️️️ #ENHYPEN #ENCHELLA #ENHYPENinCoachella_D1 #ENCHELLA2025 #Coachella #enhypencoachella https://t.co/EhyDAJtkSr;ya allah keren bangettttttt mangap mulu nonton enhypen enchella enhypenincoachellad coachella enhypencoachella
gacor abis leader kita ini en- #ENCHELLA2025;gacor abis leader en enchella
Wajib kasi tanda dikalender #ENCHELLA2025 #COACHELLA2025 #ENHYPEN;wajib kasi tanda dikalender enchella coachella enhypen
Cari duit gampang amat ya #fyp #viralreelschallenge #podcast #podcastindonesia #podcastdewasa #podcastviral #Tupperware #NETJJ #ENCHELLA2025 #BOYNEXTDOOR https://t.co/y1GJxUZPVz;cari duit gampang ya fyp viralreelschallenge podcast podcastindonesia podcastdewasa podcastviral tupperware netjj enchella boynextdoor
Sebangga itu sm anak ini #JAYatCOACHELLA #ENCHELLA2025 #ENHYPEN https://t.co/x27OPIJuqz;sebangga sm anak jayatcoachella enchella enhypen
Sekitaran taman sari jakarta barat wajib banget cobain Richeese faktori ini rasanya juara pesan sekarang di shopee food ada voucher diskon juga Link toko https://t.co/lr8tj7vnyn #ENCHELLA2025 #Coachella2025 #ShopeeID #shopeefooddiskonramerame https://t.co/CbQy66j06e;sekitaran taman sari jakarta barat wajib banget cobain richeese faktori juara pesan shopee food voucher diskon link toko enchella coachella shopeeid shopeefooddiskonramerame
@enginafess MENYALAA #ENCHELLA2025;menyalaa enchella
edisi nobar #ENCHELLA2025 bareng binyun @moonstruckest lalu kita photobooth (mw foto frame jay tp gaada bjir jadinya frame mark awokwok) lalu maem ke kopi mandja ^____^ https://t.co/u4xBjlXhET;edisi nobar enchella bareng binyun photobooth mw foto frame jay tp gaada bjir mark awokwok maem kopi mandja
@illitpopbase_ Adik kecil ILLIT yang menggemaskan peluk gllit adek satu satunya enha VAMPIRES IN THE DESERT #ENHYPEN #ENCHELLA2025 #COACHELLA2025 #ENCHELLA;adik illit menggemaskan peluk gllit adek satunya enha vampires in the desert enhypen enchella coachella
RAMBUT MERAH JGN SAMPE LOLOS LEE HEESEUNG GILAAA MENYALA BGTTT️‍️‍️‍ #ENHYPEN #ENCHELLA2025 #COACHELLA2025 #ENHYPEN_HEESEUNG https://t.co/eqVKEq5LUP;rambut merah jgn sampe lolos lee heeseung gilaaa menyala bgttt enhypen enchella coachella enhypenheeseung
gatau lagi harus bangga dengan gaya apa sama anak ini #ENHYPEN #ENCHELLA2025 #COACHELLA2025;gatau bangga gaya anak enhypen enchella coachella
"@freenameee semoga setelah coachella tadi enhypen makin besar &amp; makin banyaak orang yang melek &amp; sadar kalo enhypen tuh kereen banget coachella udah ditaklukkan abis ini dunia !! proud of them always ️. &amp; thanks for the GA kak wml hehe #ENCHELLA2025 #ENCHELLA #COACHELLA2025 #ENHYPEN https://t.co/Eb7Be5zW3r";semoga coachella enhypen amp banyaak orang melek sadar kalo tuh kereen banget udah ditaklukkan abis dunia proud of them always thanks for the ga kak wml hehe enchella
GILAAA (saya yg gila) park jongseong+park sunghoon ganteng bgtttt woyyy #ENHYPEN #ENCHELLA2025 #COACHELLA2025 #ENHYPEN_JAY #ENHYPEN_SUNGHOON https://t.co/mz7xf6CQ4w;gilaaa yg gila park jongseongpark sunghoon ganteng bgtttt woyyy enhypen enchella coachella enhypenjay enhypensunghoon
eh ini enhypen udah ada yg drag lagi jd ga sabar bakal ada good news apa #ENCHELLA2025 #COACHELLA2025 #ENHYPEN;eh enhypen udah yg drag jd ga sabar good news enchella coachella
@abcdenhaipen aku malem sebelum enchella ini ovt banget takut nanti kalo enha ga sengaja ngelakuin di drag habis2an tapi semuanya berbeda mereka bener2 nyiapin dengan mateng dan strategi mrka tuh pas banget VAMPIRES IN THE DESERT #ENHYPEN #ENCHELLA2025 #COACHELLA2025 #ENCHELLA;malem enchella ovt banget takut kalo enha ga sengaja ngelakuin drag habisan berbeda bener nyiapin mateng strategi mrka tuh pas vampires in the desert enhypen coachella
BANGGA BGT SAMA ENHA #ENCHELLA2025;bangga bgt enha enchella
terharuuu banget temenku yang demen western abiss nge komen enhypen with warm and pleasant words.. jagoanku mendunia️‍ #ENHYPEN #ENCHELLA2025 https://t.co/oKfNVqogY9;terharuuu banget temenku demen western abiss nge komen enhypen with warm and pleasant words jagoanku mendunia enchella
Dilan mainnya jauh yaaa ️ #ENCHELLA2025 #JAKE https://t.co/tPim4VXwh2;dilan mainnya yaaa enchella jake
@freenameee Thank you kaa uda adain GA wmll #ENCHELLA2025 #ENCHELLA #COACHELLA2025 #ENHYPEN;thank you kaa uda adain ga wmll enchella coachella enhypen
VAMPIRES IN THE DESERT #ENHYPEN #ENCHELLA2025 #COACHELLA2025 #ENCHELLA Bentar lagi 2M tuh Hashtag ENCHELLA https://t.co/3ezJ1aFj6b;vampires in the desert enhypen enchella coachella bentar m tuh hashtag
@freenameee Thank you for GA ka WE PROUD OF YOUU ENHYPENNNN AKU SMPE GABISA BERWORD WROD LGI SAKING KERENNYA #ENCHELLA2025 #ENCHELLA #COACHELLA2025 #ENHYPEN https://t.co/05R36kfmc9;thank you for ga ka we proud of youu enhypennnn smpe gabisa berword wrod lgi saking kerennya enchella coachella enhypen
VIRAL! Inilah Reaksi Lisa BLACKPINK Saat Melihat Penampilan ENHYPEN di Coachella 2025. Netizen: LISA Datang Nonton ENCHELLA Buat Jogde XO #LISACHELLA #LISA #ENCHELLA2025 #ENHYPEN #COACHELLA2025 #Kpop #ConnecID https://t.co/DFWxLwZzcx;viral reaksi lisa blackpink penampilan enhypen coachella netizen nonton enchella jogde xo lisachella kpop connecid
SUNOO CAKEP BANGET YAAMPUNNN #ENCHELLA #ENCHELLA2025 #Coachella #ENHYPEN https://t.co/2USI6UTWeb;sunoo cakep banget yaampunnn enchella coachella enhypen
Duh bang #ENCHELLA2025 https://t.co/taFHtu7wZp;duh bang enchella
jake ini aku milea...(logat australia) #ENCHELLA2025 https://t.co/PSotvzMCvc;jake milealogat australia enchella
#HEESEUNG #ENCHELLA2025 gaada obenggg ;heeseung enchella gaada obenggg
Oknum yang bikin oleng adalah si merah #ENCHELLA2025 #HEESEUNG #ENHYPENinCoachella_D1 https://t.co/4dFhIKwpiM;oknum bikin oleng si merah enchella heeseung enhypenincoachellad
GW SUKA BANGET bring the heat back TRIMS UDAH BAWA BTHB KE COACHELLA YA @ENHYPEN #ENCHELLA2025;gw suka banget bring the heat back trims udah bawa bthb coachella ya enchella
an angel #NI_KI #니키 #ENCHELLA2025 https://t.co/SXdRIX5oMW;an angel niki enchella
Ternyata semngat mereka udah dri 2 tahun yang lalu. Bangga sama kalian I never forget for your perfomance today 🇮🇩 #ENHYPEN #ENCHELLA2025 #SAHARA #LA #COACHELLA2025 @ENHYPEN_members https://t.co/r7jq4TX0TU;semngat udah dri bangga i never forget for your perfomance today enhypen enchella sahara la coachella
FOGI!!!!! ng heesun #ENCHELLA2025 #ENHYPEN #Coachella #SUNOO #HEESEUNG https://t.co/KEZB0KwgY5;fogi ng heesun enchella enhypen coachella sunoo heeseung
kinghoon #SUNGHOON #성훈 #HOONCHELLA #ENCHELLA2025;kinghoon sunghoon hoonchella enchella
@chaaasim semoga enha dan kakaknya all happy healthy lucky and safe Happy birthday ya kak #ENCHELLA #ENCHELLA2025 #COACHELLA2025;semoga enha kakaknya all happy healthy lucky and safe birthday ya kak enchella coachella
Kita udh di tahap enhypen tampil di Coachella ALIAS LU KEREN BNGT BRUHH #ENHYPENinCoachella_D1 #ENCHELLA2025 #ENCHELLA;udh tahap enhypen tampil coachella alias lu keren bngt bruhh enhypenincoachellad enchella
Sayangku cintaku cantik sekali Terimakasih sudah melakukan yang terbaik hari ini sayang terimakasih atas kerja kerasnya kamu keren banget Istrahat yang cukup And Stay healthy baby #ENHYPEN #ENCHELLA2025 #Coachella2025 #선우 #SUNOO https://t.co/5U4eCycpmZ;sayangku cintaku cantik terimakasih terbaik sayang kerja kerasnya keren banget istrahat and stay healthy baby enhypen enchella coachella sunoo
Bangga banget sama kalian. Walaupun aku gk ngikutin kalian dr awal debut tp aku tau perjuangan kalian gumana mulai dr i-land sampai sekarang coachella. I'M PROUD OF YOU 7BOY #ENCHELLA2025 #Coachella;bangga banget gk ngikutin dr debut tp tau perjuangan gumana iland coachella im proud of you boy enchella
@freenameee mauu ikutannn #ENCHELLA2025 #ENCHELLA #COACHELLA2025 #ENHYPEN;mauu ikutannn enchella coachella enhypen
@jungreallywon titip wish ya ️ENCHELLA DAY 2 BITE ME + DANCER CIWI² CANTIK️ #ENCHELLA2025 #ENHYPEN #Coachella2025;titip wish ya enchella day bite me dancer ciwi cantik enhypen coachella
#ENCHELLA #ENCHELLA2025 #COACHELLA2025 #ENHYPEN LEGENDARY!!!;enchella coachella enhypen legendary
@freenameee SOOOW PROUD OF THEMMM !!! semoga mereka bisa makin besar lagi makin banyak impian mereka yg bakal tercapai dan tentu mereka makin bahagiaaaa !!! #ENCHELLA #ENHYPEN #COACHELLA2025 #ENCHELLA2025 https://t.co/8gEBBoHPLr;sooow proud of themmm semoga impian yg tercapai bahagiaaaa enchella enhypen coachella
@chaaasim kakk chaa happy birthday yaaa i hope rezeki kak cha dilancarkan dan enhypen semakin sukses after coachella inii aaminn #ENCHELLA2025 #COACHELLA2025 #ENHYPEN;kakk chaa happy birthday yaaa i hope rezeki kak cha dilancarkan enhypen sukses after coachella inii aaminn enchella
Omegat bebs cantip+ganteng nyooo #ENCHELLA2025 #ENHYPEN_SUNOO https://t.co/7lgJJ8oHAo;omegat bebs cantipganteng nyooo enchella enhypensunoo
So proud of you sayangkuu ️‍ Terimakasih sudah memberikan penampilan yang spektakuler hari ini let's go #ENCHELLA sampai jumpa Minggu depan #ENCHELLA2025 #ENHYPEN #Coachella https://t.co/CDfKemgIca;so proud of you sayangkuu terimakasih penampilan spektakuler lets go enchella jumpa minggu enhypen coachella
SEBANGGAAAAA ITU GWWWWW COYYYYYYYY #ENCHELLA2025 #ENHYPEN #Coachella;sebanggaaaaa gwwwww coyyyyyyyy enchella enhypen coachella
@starfess Rambut nya klimis klimis ya #ENHYPEN #ENCHELLA2025 #COACHELLA2025;rambut nya klimis ya enhypen enchella coachella
