full_text;clean_text
@freenameee thanks for the GA kak! bangga bgt sama enhaa semoga makin terkenal dan sukses kedepannya #ENCHELLA2025 #ENCHELLA #COACHELLA2025 #ENHYPEN https://t.co/SO06Ce1VBq;thanks for the ga kak bangga bgt enhaa semoga terkenal sukses kedepannya enchella coachella enhypen
Heeseung ini LA Agenda nambah bini berhasil Kiw kiw red sexy guy #ENCHELLA2025 #ENHYPEN https://t.co/IJGrIBLZJw;heeseung la agenda nambah bini berhasil kiw red sexy guy enchella enhypen
#ENCHELLA2025 ini menghibur banget bikin bangga iya vocal sama stage presence gila banget udh gitu dikasih momen kapal gw lagi gilaaaa ;enchella menghibur banget bikin bangga iya vocal stage presence gila udh gitu dikasih momen kapal gw gilaaaa
AMPUNNN GW AMPUNNN #ENCHELLA2025 #ENHYPEN #JUNGWON https://t.co/BP2FrbsMX9;ampunnn gw enchella enhypen jungwon
@jaeyunutella nahh duo ini gacor hotnya #ENHYPEN #ENCHELLA #ENCHELLA2025 #JUNGWON #HEESEUNG https://t.co/1ncSCjwSaY;nahh duo gacor hotnya enhypen enchella jungwon heeseung
@freenameee thank you kak udah adain giveaway ini! so proud of them karena bisa sampe ke titik ini.... huhu kehabisan kata kata untuk mereka pokoknya bangga banget! #ENCHELLA2025 #ENCHELLA #COACHELLA2025 #ENHYPEN https://t.co/81zzwatdpM;thank you kak udah adain giveaway so proud of them sampe titik huhu kehabisan pokoknya bangga banget enchella coachella enhypen
shim dilan 2025 #ENCHELLA2025;shim dilan enchella
@starfess yang habis tampil di coachella 2025 #ENCHELLA2025 https://t.co/giq6gqkBws;habis tampil coachella enchella
hari ini tercatat sebagai hari bahagia #ENCHELLA2025 #CUMAONIC;tercatat bahagia enchella cumaonic
@abcdenhaipen MANTAP WOIII ENHYPEN ENGENE POKOKNYA GUA SAYANG KALIAN. PLEASE UP KOMEN YANG PUJI ENHYPEN TAPI KALAU NEMU YANG HATE LANGSUNG REPORT AJA GAWSAH DI RAMEIN #COACHELLA2025 #ENHYPEN #ENCHELLA #ENCHELLA2025;mantap woiii enhypen engene pokoknya gua sayang please up komen puji nemu hate langsung report aja gawsah ramein coachella enchella
siapa yg tadi bingung bgt ditinggal enhypen tanpa ucap terimakasih atau goodbye atau apapun itu berasa ditinggal separuh jiwa sama para bujang ituuu #ENCHELLA2025 #ENHYPEN;yg bingung bgt ditinggal enhypen terimakasih goodbye apapun berasa separuh jiwa bujang ituuu enchella
KEREN BGT URI ENHYPEN #ENCHELLA2025 https://t.co/ODcI5jUjJb;keren bgt uri enhypen enchella
bener bener bangga banget sama mereka aku ngikutin dan dukung enhypen dari masih jaman telur dan sekarang mereka udah tumbuh BESAR #COACHELLA2025 #ENHYPEN #ENCHELLA #ENCHELLA2025 https://t.co/9kkiaGUg0x;bener bangga banget ngikutin dukung enhypen jaman telur udah tumbuh coachella enchella
LEGENDARY #ENCHELLA #ENCHELLA2025 #ENHYPEN #HEESEUNG https://t.co/hr50QZ8DsY;legendary enchella enhypen heeseung
gila gua nonton enhypen #ENCHELLA2025 #ENHYPENinCoachella_D1;gila gua nonton enhypen enchella enhypenincoachellad
beneran nambah istri blio ini #ENCHELLA #ENCHELLA2025 #COACHELLA2025 #ENHYPEN #HEESEUNG https://t.co/U0Q7t9V8qm;beneran nambah istri blio enchella coachella enhypen heeseung
ANJAYYYYY TRACK LIST NYA CAKEP BGTTTTT ENHAAA ️‍ #ENCHELLA2025 #ENHYPEN;anjayyyyy track list nya cakep bgttttt enhaaa enchella enhypen
eh gue beneran tadi di busway merinding sekujur badan gue beneran bangga bgt cok sama mereka #ENCHELLA2025 #ENHYPEN #COACHELLA2025;eh gue beneran busway merinding sekujur badan bangga bgt cok enchella enhypen coachella
alias LO KEREN BANGET SUMPAH PEN CINTA MATIK GUE AMA LO SEMUAA ️‍️‍️‍ #ENCHELLA2025 https://t.co/TqYxesrVnx;alias lo keren banget sumpah pen cinta matik gue ama semuaa enchella
baru nonton DAN INI SANGAT AMAAT MENGGUNCANG DAN UHUYYYY ️‍ #ENCHELLA2025 https://t.co/PBDY6KHS6l;nonton amaat mengguncang uhuyyyy enchella
DISINI GAADA YG OLENG KE BBYGROWL SUNOO KAH? GUE SEPANJANG NONTON MESMERIZED BGT LIAT SUNOO #ENCHELLA2025 #ENCHELLA #ENHYPEN https://t.co/hAFYYfw5Kj;gaada yg oleng bbygrowl sunoo kah gue nonton mesmerized bgt liat enchella enhypen
and yap suka bgt part sunghoon ini️ #ENHYPEN #ENCHELLA2025;and yap suka bgt part sunghoon enhypen enchella
@freenameee Wml semoga enhypen semakij jaya #ENCHELLA2025 #ENCHELLA #COACHELLA2025 #ENHYPEN;wml semoga enhypen semakij jaya enchella coachella
Suka banget paranormal versi #ENCHELLA #ENCHELLA2025;suka banget paranormal versi enchella
kalian keren banget jujur bangga sebangga bangga nya. you did it boys️ #enhypencoachella #COACHELLA2025 #ENHYPEN #ENCHELLA2025 https://t.co/HHv3ocQ3mo;keren banget jujur bangga sebangga nya you did it boys enhypencoachella coachella enhypen enchella
@abcdenhaipen MEREKA EMANG DESERVE DI PUJI UGAL2AN #ENCHELLA #ENHYPEN #ENCHELLA2025 @ENHYPEN_members @ENHYPEN;emang deserve puji ugalan enchella enhypen
@chaaasim Waa happy birthday kakkk semoga panjang umur sehat selaluuuu Semoga enhypen setelah Coachella ini bisa tambah bersinar banyakk mendapat penghargaan. Semoga anak anak selalu sehatt dan selalu dikelilingi orang-orang baik #ENCHELLA2025 #COACHELLA2025 #ENHYPEN https://t.co/1SrwjLBEqj;waa happy birthday kakkk semoga umur sehat selaluuuu enhypen coachella bersinar banyakk penghargaan anak sehatt dikelilingi orangorang enchella
JAKECHELLA #ENHYPEN #ENCHELLA2025 #ENCHELLA https://t.co/1lg3lvlsTR;jakechella enhypen enchella
@welltstars mereka keren bangett #ENCHELLA #ENCHELLA2025 #COACHELLA2025 #ENHYPEN;keren bangett enchella coachella enhypen
"aku tau vokal mereka baguss tapi ga expect bisa se stabil &amp; sebagoosss ini #ENCHELLA2025";tau vokal baguss ga expect stabil amp sebagoosss enchella
MELELEHHH #ENCHELLA #ENCHELLA2025;melelehhh enchella
Tadi masih di gym skrg dirumah nonton #ENCHELLA2025 sama bapake lah https://t.co/axym1uTiCc;gym skrg dirumah nonton enchella bapake
@jsyrwmin 1. sunghoon 2. sunghoon 3. HEESEUNG #ENCHELLA2025 #COACHELLA2025 #ENHYPEN;sunghoon heeseung enchella coachella enhypen
ga tau lagii mau nangis ajaa #ENCHELLA #ENCHELLA2025 #ENHYPEN #COACHELLA2025;ga tau lagii nangis ajaa enchella enhypen coachella
JAYWON SELALU DIDEPANN #JAY #ENHYPEN #JUNGWON #ENCHELLA2025 #ENCHELLA https://t.co/TZRbWee0dp;jaywon didepann jay enhypen jungwon enchella
GILSSSS INI FOTO TERBAIK GETTY IMAGES SIH APPROVED BY DERPBLUEMOON #HEESEUNG #JUNGWON #ENCHELLA #ENCHELLA2025 https://t.co/A37sM8gWFM;gilssss foto terbaik getty images sih approved by derpbluemoon heeseung jungwon enchella
Berdua di pantai #COACHELLA2025 #LaCasaDeLosFamososCol #amici24 #النصر_الرياض #ENCHELLA2025 https://t.co/o2LsZcGUnR;berdua pantai coachella lacasadelosfamososcol amici enchella
Lucu bangen jaywon kitaaa #ENCHELLA2025 https://t.co/aEUoaUgijl;lucu bangen jaywon kitaaa enchella
pesona dilan bgt #JAKE #ENCHELLA2025 #ENHYPEN https://t.co/NjLEtRwJfE;pesona dilan bgt jake enchella enhypen
aslinya buat nambahin duit jajan ajasi dengan spek motor yg kyk gini wkwkwk #Aprilia #apriliaracing #apriliamotor #memeaprilia #mememotor #memeindonesia #ngakak #dagelan #lucuabis #kocak #COACHELLA2025 #COACHELLA2025 #ENCHELLA2025 #amici24 #Coachella @ApriliaOfficial https://t.co/WOnary4DeZ;aslinya nambahin duit jajan ajasi spek motor yg kyk gini wkwkwk aprilia apriliaracing apriliamotor memeaprilia mememotor memeindonesia ngakak dagelan lucuabis kocak coachella enchella amici
@freenameee thank you for the GA kak! semoga Enhypen semakin lebih terkenal lagi semoga comeback nanti bisa borong banyak piala untuk di bawa pulang #ENCHELLA2025 #ENCHELLA #COACHELLA2025 #ENHYPEN;thank you for the ga kak semoga enhypen terkenal comeback borong piala bawa pulang enchella coachella
@abcdenhaipen iyaa aku aja kagett mereka beberapa kali nurunin mic dan suaranya gaadaaa eii. tapi backtrack nya tu adaa cuma pelannnnnnnnnn banget :33 menyalaa my seven- #ENCHELLA #ENCHELLA2025 #ENHYPEN #COACHELLA2025;iyaa aja kagett kali nurunin mic suaranya gaadaaa eii backtrack nya tu adaa pelannnnnnnnnn banget menyalaa my seven enchella enhypen coachella
Blockbuster Sunghoon Owwwhh Myyy Goddddd #SUNGHOON #ENCHELLA2025 #ENHYPEN;blockbuster sunghoon owwwhh myyy goddddd enchella enhypen
sujud ege penguasa bumi ini #COACHELLA2025 #ENCHELLA2025 #ENHYPENinCoachella #ENHYPEN #ENCHELLA2025 https://t.co/wR4XlmNFxy;sujud ege penguasa bumi coachella enchella enhypenincoachella enhypen
Kelock dong Maaf terlalu excited #ENCHELLA2025 #COACHELLA2025 #ENHYPEN;kelock maaf excited enchella coachella enhypen
ini lah reaksi gue trhdp #ENCHELLA2025 #ENCHELLA https://t.co/P693xfCBAF;reaksi gue trhdp enchella
@cricbuzz @tiwarymanoj @rohangava9 @manishbatavia Congratulations Rajat bro #amici24 #ENCHELLA2025;congratulations rajat bro amici enchella
Terharu ternyata enhypen udah sebesar ini ️️ #ENCHELLA2025 #ENCHELLA #COACHELLA2025 https://t.co/GJSlUy9TRS;terharu enhypen udah enchella coachella
tolong siapapun doain aku mingdep libur kerja biar biasa puas nontonin #ENCHELLA2025 ;tolong doain mingdep libur kerja biar puas nontonin enchella
pengen muter balik waktu HARUSSNYA AKU BISA NONTON #ENCHELLA2025 ;pengen muter harussnya nonton enchella
@freenameee izin ikutannn kakk wml #ENCHELLA2025 #ENCHELLA #COACHELLA2025 #ENHYPEN;izin ikutannn kakk wml enchella coachella enhypen
@freenameee Semoga kedepan nya jalan enha semakin lancar dijauhkan orang jahat dan SEMOGA CB NANTI SUKSES wml #ENCHELLA2025 #ENCHELLA #COACHELLA2025 #ENHYPEN;semoga kedepan nya jalan enha lancar dijauhkan orang jahat cb sukses wml enchella coachella enhypen
Lisa : lagu hoobae ku satu ini juga goyang dikit ah️ #LISA #ENHYPEN #ENCHELLA2025 https://t.co/G6e1trk3fF;lisa lagu hoobae ku goyang dikit ah enhypen enchella
GIVE AWAY DADAKAN !! pemenang nya dapet : 1 doll enha (random pokonya aku juga lagi milih siapa yang mau di lepas ) end jam 20.00 (langsung spin pemenang) JANGAN LUPA HESTEG #ENCHELLA2025 #ENCHELLA #COACHELLA2025 #ENHYPEN https://t.co/BQ5wOvIz1s;give away dadakan pemenang nya dapet doll enha random pokonya milih lepas end jam langsung spin lupa hesteg enchella coachella enhypen
siapapun mutualan sama aku PLEASE yang ngga keberatan dengan akun aku yang multifandom kita hype #ENCHELLA2025 WEEK-2 bareng-bareng yuuuk;mutualan please ngga keberatan akun multifandom hype enchella week barengbareng yuuuk
@enhapolls RIKIII #ENCHELLA2025 #ENHYPEN #COACHELLA2025 #ENCHELLA;rikiii enchella enhypen coachella
ini maksudnya melet2 tu buat apa yah biar aku terpelet gt kh #ENCHELLA2025 https://t.co/qHR6fVTMIh;maksudnya melet tu yah biar terpelet gt kh enchella
ya Allah bertekuk lutut aku mas... #ENCHELLA2025 https://t.co/QNYd8215Vq;ya allah bertekuk lutut mas enchella
klo dilepas bisa gila sendiri SEMUA MEMBER ALLAHUAKBAR LAAILAAHAILLALLAH LAA HAWLA WA LAA QUWWATA ILLAA BILLAH TAKBIIIRRRR STRESS BANGET ENHYPEN #ENCHELLA2025 https://t.co/ulw7PP0hd8;klo dilepas gila member allahuakbar laailaahaillallah laa hawla wa quwwata illaa billah takbiiirrrr stress banget enhypen enchella
@urmyjongstar MAUU KAA @nyxnoxius #COACHELLA2025 #Coachella #ENHYPEN #ENCHELLA2025;mauu kaa coachella enhypen enchella
Begini rasanya kalo idol gw have a stage in Coachella bangga seneng terharu padahal gw tau mereka bahkan ga tau gw ada didunia ini definisi bukan siapa2 hashtag #ENCHELLA2025 #ENHYPEN #COACHELLA2025;kalo idol gw have a stage in coachella bangga seneng terharu tau ga didunia definisi hashtag enchella enhypen
Siapa yang merinding denger moonstruck live vocal? #COACHELLA2025 #ENCHELLA2025;merinding denger moonstruck live vocal coachella enchella
Yang pake jaket dilan itu backdancer ya guys bukan member enhypennya membernya yang lain yang rambutnya merah apa yang bocil kutang prada aja jangan yang jaket dilan #ENCHELLA2025 (JK PLIS WELCOME TO ENGENE WORLD );pake jaket dilan backdancer ya guys member enhypennya membernya rambutnya merah bocil kutang prada aja enchella jk plis welcome to engene world
ini merekam sambil tutup mulut takut menggelegar klo kelepasan teriak #ENCHELLA2025 https://t.co/yHD9S4k6Wk;merekam tutup mulut takut menggelegar klo kelepasan teriak enchella
dan yap ini dia oknum yang bikin gonjang ganjing warga #ENCHELLA2025 https://t.co/6Z0g3CqkeI;yap oknum bikin gonjang ganjing warga enchella
ini kalo ketawa pragos ngambek ga ya???tapi lucuuuu mianhae oppa#ENCHELLA2025 #ENHYPEN #ENHYPENinCoachella_D1 #ENHYPEN #COACHELLA2025 https://t.co/jrvBhZNQC5;kalo ketawa pragos ngambek ga yatapi lucuuuu mianhae oppaenchella enhypen enhypenincoachellad coachella
Menyala Enhypen #ENHYPEN #ENCHELLA2025 https://t.co/IsYIe0aFqu;menyala enhypen enchella
ihhahjskwjeh nishimura riki pranowo #COACHELLA2025 #ENCHELLA2025 https://t.co/R0i1QPLRCL;ihhahjskwjeh nishimura riki pranowo coachella enchella
#enask sorry oot mengingat #ENCHELLA2025 hari ini aku masih merasa bangga kalau misal GA in doll ada yang mauu gaaaaaaa;enask sorry oot enchella bangga ga in doll mauu gaaaaaaa
Bener penguasa bumi #HEESEUNG #희승 #이희승 #ENHYPEN #엔하이픈 #ヒスン #エンハイプン #ENCHELLA #ENCHELLA2025 #COACHELLA2025 https://t.co/rU48wJu20Z;bener penguasa bumi heeseung enhypen enchella coachella
tau gak sih aku tuh tadi mantengin #ENCHELLA2025 pas masih di jalan dan itu jam setengah 12 panas bngttt tapi gapapa soalnya mereka menyala bngttt https://t.co/C58mItxLoB;tau gak sih tuh mantengin enchella pas jalan jam panas bngttt gapapa menyala
"Pas di panggung coachella : Pass turun panggung coachella : Pas di stage ganteng banget nunu buseettt skrg kembali ke setelan awal cutie smoll &amp; imut #SUNOO_SpiceUp_Coachella #SUNOO #ENCHELLA2025 #COACHELLA2025 https://t.co/Pps5LMbqtZ";pas panggung coachella pass turun stage ganteng banget nunu buseettt skrg setelan cutie smoll amp imut sunoospiceupcoachella sunoo enchella
was supporting my boys in my kondangan fits (multi-task) (walopun ga bs denger suaranya) (enhypen keren BANGET) #ENCHELLA2025 https://t.co/lB6NeDOnru;was supporting my boys in kondangan fits multitask walopun ga bs denger suaranya enhypen keren banget enchella
BARUU MAU BILANGG BEGINII DARITADIII #ENHYPEN #ENCHELLA #ENCHELLA2025 #COACHELLA2025;baruu bilangg beginii daritadiii enhypen enchella coachella
@abcdenhaipen BANGGAN BGT SAMA MEREKAA PLSSSSS #ENHYPEN #ENCHELLA2025 #COACHELLA2025;banggan bgt merekaa plsssss enhypen enchella coachella
Lagi ada promo diskon McDonald's duren sawit jakarta timur buruan pesan sekarang Link toko https://t.co/rzAsSPNRSC #LISACHELLA #ENCHELLA2025 #ShopeeFood https://t.co/GcBxqIl0np;promo diskon mcdonalds duren sawit jakarta timur buruan pesan link toko lisachella enchella shopeefood
aduh keren bgt lagi VAMPIRES IN THE DESERT #ENCHELLA #ENCHELLA2025 #ENHYPEN #COACHELLA2025;aduh keren bgt vampires in the desert enchella enhypen coachella
Setelah sekian lama akhirnya Live OT7 #엔하이픈 #ENHYPEN #JUNGWON #HEESEUNG #JAY #JAKE #SUNGHOON #SUNOO #NI_KI #ENCHELLA2025 #COACHELLA2025 https://t.co/1XxbheSxV7;sekian live ot enhypen jungwon heeseung jay jake sunghoon sunoo niki enchella coachella
PENAMPILAN KALIAN HARI INI PECAH BANGETT KERENNN. ENGENE'S PROUD OF ENHYPEN WE LOVE U AND ALWAYS SUPPORT️‍ #ENCHELLA2025 At #COACHELLA2025 https://t.co/2FEPd4ybr9;penampilan pecah bangett kerennn engenes proud of enhypen we love u and always support enchella at coachella
PALONG PALO ANG BABY NA YAN #ENHYPEN #ENCHELLA2025 #HEESEUNG https://t.co/r2J0t308lx;palong palo ang baby na yan enhypen enchella heeseung
enhypen udah tampil belum? #ENCHELLA2025;enhypen udah tampil enchella
terimakasih sudah mampir live ya️ u did so well today my seven️ selamat beristirahat️ #ENHYPEN #ENCHELLA2025 #COACHELLA2025 @ENHYPEN_members https://t.co/QQVi7qekie;terimakasih mampir live ya u did so well today my seven selamat beristirahat enhypen enchella coachella
Gue nyaris nangis tuh krn pas lagu apa y gue lupa itu fanchantnya kedengeran keras bgt di livestreamnya. Kayak kayak kayak duh gila di kepala gue brisik bgt krn saking bangganya huhu #ENCHELLA2025;gue nangis tuh krn pas lagu y lupa fanchantnya kedengeran keras bgt livestreamnya kayak duh gila kepala brisik saking bangganya huhu enchella
UWON KAMU HARI INI PETCAHHHHHH BANGETTTT GACORRRRR AKU PEN JEDOTIN PALA KEDINDING AJA RASANYA️‍ #JUNGWON #ENCHELLA2025 https://t.co/N7RIkZfdME;uwon petcahhhhhh bangetttt gacorrrrr pen jedotin pala kedinding aja jungwon enchella
BANGGA BANGETT Iloveyou enhypenn #ENCHELLA2025 #COACHELLA2025 #ENHYPEN @ENHYPEN #ENHYPENinCoachella_D1 https://t.co/Io84RdxPya;bangga bangett iloveyou enhypenn enchella coachella enhypen enhypenincoachellad
Kangen banget #ENCHELLA #ENCHELLA2025 #ENHYPEN #ENHYPENinCoachella_D1 https://t.co/U3vE7u7e5j;kangen banget enchella enhypen enhypenincoachellad
Bangga bgt punya enhypen Mereka bener bener nunjukin kalo mereka berkembang mulai dari dpt nominasi daesang trs skrng bisa tampil di coachella bener bener bangga bgt️‍kalian deserve dpt ini bahkan lebih dari ini!! I LOVE U GUYS!️‍ #COACHELLA2025 #ENHYPEN #ENCHELLA2025 https://t.co/A1n48K28Pn;bangga bgt enhypen bener nunjukin kalo berkembang dpt nominasi daesang trs skrng tampil coachella bgtkalian deserve i love u guys enchella
ADEKKKK KAMU KERENNN BANGET BENERAN KEREN BANGET ️‍ #NI_KI #ENCHELLA2025 https://t.co/o6wANDsj6B;adekkkk kerennn banget beneran keren niki enchella
#ENCHELLA2025 #COACHELLA2025 #ENHYPEN KERENNNNN BANGETTTT https://t.co/Ls2TcWDsOy;enchella coachella enhypen kerennnnn bangetttt
Yg inih yayah papi #Heejake #엔하이픈 #ENHYPEN #HEESEUNG #JAKE #COACHELLA2025 #ENCHELLA2025 https://t.co/A6BoRbZk8n;yg inih yayah papi heejake enhypen heeseung jake coachella enchella
cintaku sumpah seneng banget pas nunu di sorot kamera tuh pada teriakk kencengggg nunu juga hari ini keren bangett ️‍ #SUNOO_SpiceUp_Coachella #ENCHELLA2025 https://t.co/pJBLB9cw0O;cintaku sumpah seneng banget pas nunu sorot kamera tuh teriakk kencengggg keren bangett sunoospiceupcoachella enchella
only one boygroup KPop di yang perform di Coachella 2025 ini bangga banget #COACHELLA2025 #ENCHELLA2025 #ENCHELLA https://t.co/7c6A10twRR;only one boygroup kpop perform coachella bangga banget enchella
PESULAP MERAH AKU PADAMU #ENCHELLA2025 #ENHYPEN #COACHELLA2025;pesulap merah padamu enchella enhypen coachella
MANA BENERAN KETEKAN LAGI SI ANJIR WON MAKASIH WON MAKASIH YA ALLAH ADA GILA GILANYA ENCHELLA HARI NI #COACHELLA2025 #ENCHELLA2025 #enhypencoachella #JUNGWON https://t.co/vDHiVdBRdV;beneran ketekan si anjir won makasih ya allah gila gilanya enchella ni coachella enhypencoachella jungwon
"Makasih Bangtan krn sudah membuat ku menonton I-land &amp; end up stanning ENHYPEN. The best decision I've ever made during corona era wkwk #ENHYPEN #ENCHELLA2025";makasih bangtan krn ku menonton iland amp end up stanning enhypen the best decision ive ever made during corona era wkwk enchella
@abcdenhaipen they deserve this.. aku bangga banget bahkan kata bangga aja ga cukup buat mereka #ENCHELLA2025 #ENHYPEN #ENCHELLA;they deserve this bangga banget aja ga enchella enhypen
Kalo heeseung sih udah biasa ini jungwon. Jungwwooonnn Omaigaatttt #ENCHELLA2025 ️‍️‍️‍;kalo heeseung sih udah jungwon jungwwooonnn omaigaatttt enchella
bangga bangettt tl penuh hal-hal positif dari enha tampil sampai skrg belum nemu komen neg atif ttg #ENCHELLA2025 VAMPIRES IN THE DESERT #ENCHELLA #ENHYPEN #COACHELLA2025 @ENHYPEN @ENHYPEN_members https://t.co/xudpSmpOdw;bangga bangettt tl penuh halhal positif enha tampil skrg nemu komen neg atif ttg enchella vampires in the desert enhypen coachella
@divengenes Nggak bisa enhypen keren banget tadi di coachelle #ENCHELLA2025 #ENCHELLA #ENHYPEN #COACHELLA2025;nggak enhypen keren banget coachelle enchella coachella
@ihoonski yuuurpp #ENCHELLA2025 #ENCHELLA #ENHYPEN;yuuurpp enchella enhypen
HUHUHU baru beres nonton enchella walopun nggak live gak nyangka mereka jadi sebesar ini sekarang.... Dulu masih cimit masih dedek bau telon sekarang sudah bau duit bau sukses I am beyond proud of you boys @ENHYPEN_members you guys did soooo welllll #ENCHELLA2025;huhuhu beres nonton enchella walopun nggak live gak nyangka cimit dedek bau telon duit sukses i am beyond proud of you boys guys did soooo welllll
Lucu banget Heeseung #ENCHELLA #ENCHELLA2025 #ENHYPEN;lucu banget heeseung enchella enhypen
enha melet aku kepelet #ENHYPEN #ENCHELLA #ENCHELLA2025 https://t.co/VcKi7jJHf0;enha melet kepelet enhypen enchella
