full_text;clean_text
@bundJakeSim #ENCHELLA2025 bakal selalu ngebekas di kepala engene sampai kapan pun itu;enchella ngebekas kepala engene
LIHATTT LAYOUT IMUPKU SUDAH DATANG!!! terima kasih kak eileen @moccapucinou yang mengadakan GA special #ENCHELLA2025 dan kucing imut yang ulang tahun tanggal 20 kemarin! #WeavingOurFateswithJAY terima kasih juga kak mimo atas layout imup nan cantik ini @bymimyo https://t.co/XodZhhACYy;lihattt layout imupku terima kasih kak eileen mengadakan ga special enchella kucing imut ulang tanggal kemarin weavingourfateswithjay mimo imup nan cantik
KALIAN LUAR BIASA KEREN BANGET BANGGA BANGET SAMA KALIAN PEN MAKIN BERSINAR MAKIN SUKSES YA KALIAN DAN SEMOGA KEDEPANNYA PUNYA FANS YANG LUAR BIASA BAIK SALING DEWASA+ROYAL JUGA AAMIIN #ENCHELLA #ENCHELLA2025 #ENHYPEN https://t.co/mAt3zMRPyd;keren banget bangga pen bersinar sukses ya semoga kedepannya fans dewasaroyal aamiin enchella enhypen
jjungnyangg #ENHYPEN #JUNGWON #ENCHELLA2025 https://t.co/4xuMH0alTh;jjungnyangg enhypen jungwon enchella
@icefics_ @HalloEnHi2 @ENHYPEN Sana ma pili pls pls. #SUNGHOON #SUNOO #ENCHELLA2025 #Coachella2025 #ENHYPEN @ENHYPEN;ma pili pls sunghoon sunoo enchella coachella enhypen
@Music Wow enhypen #ENHYPEN #ENCHELLA #ENCHELLA2025;wow enhypen enchella
@icefics_ @HalloEnHi2 @ENHYPEN #SUNGHOON #SUNOO #ENCHELLA2025 #Coachella2025 #ENHYPEN @ENHYPEN sana machews jebal;sunghoon sunoo enchella coachella enhypen machews jebal
Sayang-sayangku...liat! @ENHYPEN @ENHYPEN_members #ENCHELLA #ENCHELLA2025 #ENHYPEN #Coachella2025;sayangsayangkuliat enchella enhypen coachella
@icefics_ @HalloEnHi2 @ENHYPEN #SUNGHOON #SUNOO #ENCHELLA2025 #Coachella2025 #ENHYPEN @ENHYPEN Sana ma pick sana ma chews;sunghoon sunoo enchella coachella enhypen ma pick chews
Mantap #ENCHELLA2025;mantap enchella
aaaaa bangga bangettt #ENHYPEN #ENCHELLA2025;aaaaa bangga bangettt enhypen enchella
[RANDOM | 250420] NO ESTOY BIEN Cr. pshoonieyoi 【】 #희승 #NoDoubt #ENCHELLA2025 #XO #Daydream #OnlyIfYouSayYes @ENHYPEN_members @ENHYPEN https://t.co/v8tGgjpx0B;random no estoy bien cr pshoonieyoi nodoubt enchella xo daydream onlyifyousayyes
 #ENCHELLA #ENCHELLA2025 #ENHYPEN #Loose #Coachella2025 @woniepedia @wonfixation @rockstarikeu mwah https://t.co/PmZhD4cGs4;enchella enhypen loose coachella mwah
𝐒𝐀𝐍𝐆𝐓𝐎𝐓𝐎 Tersedia Games 1. Togel 2. Slot Games 3. Live Games Games Seru dan Kemenangan Real Dibayarkan LUNAS tanpa Cicil. Join Now! https://t.co/azQ3No4Mzb #sangtoto #ENCHELLA #ENHYPEN #englot #ENCHELLA2025 #WrestleMania #WrestleMania41 #RENATACAMPEA #Rosettes #news https://t.co/RdcwAfIgtd;tersedia games togel slot live seru kemenangan real dibayarkan lunas cicil join now sangtoto enchella enhypen englot wrestlemania renatacampea rosettes news
si si pa cuando foto de Jennie x enhypen #JENCHELLA2025 #JENNIE #JENNIECoachella #ENCHELLA2025;si pa cuando foto de jennie x enhypen jenchella jenniecoachella enchella
@YJWLOOKS #ENHYPEN #ENCHELLA #ENCHELLA2025 let's talk about it ampe gumohhh pokoknya;enhypen enchella lets talk about it ampe gumohhh pokoknya
Auranya mahal bgt pen #ENCHELLA #ENCHELLA2025 #ENHYEPN;auranya mahal bgt pen enchella enhyepn
Demi apapun semenjak video jake yg itu lewat di setiap tl gua. GUA BENERAN UDAH GA BISA LIAT DIA SEBAGAI ANAK IMUT LUCU MUNGIEL KECIL CANTIK MENGGEMASKAN LAGI yg aku lihat sekarang hanyalah Big thanks to coachella #ENHYPEN #ENHYPEN_JAKE #ENCHELLA2025 #Choachella2025;apapun semenjak video jake yg tl gua beneran udah ga liat anak imut lucu mungiel cantik menggemaskan lihat big thanks to coachella enhypen enhypenjake enchella choachella
Siapa yang masih belum bisa move on dari penampilan ENHYPEN di Coachella? ENHYPEN x Coachella: Legendaris! #ENHYPEN #ENCHELLA2025 #COACHELLA2025 #JUNGWON #HEESEUNG #JAY #JAKE #SUNGHOON #SUNOO #NI_KI https://t.co/cII0YQB4pq;move on penampilan enhypen coachella x legendaris enchella jungwon heeseung jay jake sunghoon sunoo niki
@findcamie ni-ki #ENCHELLA #ENCHELLA2025 #COACHELLA2025 #ENHYPEN;niki enchella coachella enhypen
@findcamie heeseung #ENCHELLA #ENCHELLA2025 #COACHELLA2025 #ENHYPEN;heeseung enchella coachella enhypen
Cakep bgt #JAKE #ENCHELLA #ENCHELLA2025;cakep bgt jake enchella
Di Enchella week2 ini bner2 dbkin stay terus pantengin duo cwo sendiri Kalian keren banget luar biasa keren enhypen juga keren abis #ENCHELLA #ENCHELLA2025 #ENHYPEN_JAKE #ENHYPEN_JAY #ENHYPEN https://t.co/CxqmvDzjjD;enchella week bner dbkin stay pantengin duo cwo keren banget enhypen abis enhypenjake enhypenjay
Nih 3 manusia kenapa bisa seganteng ini sih setiap gue liat ftonya reflex bilang masyaallah sungguh indah ciptaan mu Tuhan #ENCHELLA #ENHYPEN #ENHYPEN_JAKE #ENHYPEN_JAY #ENHYPEN_HEESEUNG #ENCHELLA2025 https://t.co/izMcyAOW0K;nih manusia seganteng sih gue liat ftonya reflex bilang masyaallah sungguh indah ciptaan mu tuhan enchella enhypen enhypenjake enhypenjay enhypenheeseung
yaaaah leeeeee #HEESEUNG #ENCHELLA #ENCHELLA2025;yaaaah leeeeee heeseung enchella
Riki #NI_KI #니키 #ニキ #西村力 #엔하이픈 #ENHYPEN #Coachella2025 #ENCHELLA2025;riki niki enhypen coachella enchella
ayo hit tweet??? #ENHYPEN #ENCHELLA #ENCHELLA2025 #COACHELLA2025 https://t.co/o8F0P3WNCY;ayo hit tweet enhypen enchella coachella
jay ganteng bgt jjr hari ini #ENCHELLA2025;jay ganteng bgt jjr enchella
@hananaayouuii asli njir gua uh mtk juga tapi bodoamat yang menting #ENCHELLA2025 #ENHYPEN #COACHELLA2025;asli njir gua uh mtk bodoamat menting enchella enhypen coachella
Jadi kayak gini yg dinamakan sepi???mamam tuh sepi..!!! #ENHYPEN #ENCHELLA #ENCHELLA2025 #COACHELLA2025 https://t.co/KZgR414TrJ;kayak gini yg dinamakan sepimamam tuh sepi enhypen enchella coachella
maju sini atu atu #JAKE #ENHYPEN #ENHYPEN_JAKE #ENCHELLA2025 https://t.co/zB3UnXElAT;maju atu jake enhypen enhypenjake enchella
Coachella week 2 gebrakannya bukan maen #ENHYPEN #ENCHELLA2025 #COACHELLA2025;coachella week gebrakannya maen enhypen enchella
DAMN...GEMETER DIKIT GAK NGARUH‍️ #heejake #라면즈 #ramyonz #ENHYPEN #엔하이픈 #HEESEUNG #희승 #ヒスン #JAKE #제이크 #ジェイク #ENCHELLA #ENCHELLA2025 https://t.co/6Bb0EwfHvB;damngemeter dikit gak ngaruh heejake ramyonz enhypen heeseung jake enchella
Happy birthday sa bias kong sarap na sarap raw sa sarili eh masarap naman talaga!!! HABADU MY JAYIIII!!!! #ENCHELLA2025 #ENHYPEN #COACHELLA2025 https://t.co/858OP1Cl3u;happy birthday sa bias kong sarap na raw sarili eh masarap naman talaga habadu my jayiiii enchella enhypen coachella
hehe keren.. [MSH GILA SPEECHLESS BGT] #ENHYPEN #ENCHELLA2025 #ENCHELLA #COACHELLA2025;hehe keren msh gila speechless bgt enhypen enchella coachella
Bangga banget gw ama enhypen #ENCHELLA2025;bangga banget gw ama enhypen enchella
Menyarrahh abang kuh #ENCHELLA2025 #ENHYPEN_HEESEUNG #ENHYPEN_JAKE https://t.co/gGwPMEsSEg;menyarrahh abang kuh enchella enhypenheeseung enhypenjake
yEAYYY menamatkan #ENCHELLA2025 met ultahh jeyii ‍️;yeayyy menamatkan enchella met ultahh jeyii
COWO AKU GANTENG BANGET GAKUATTTT #ENCHELLA #ENCHELLA2025 #ENHYPEN https://t.co/VQJUsYXa02;cowo ganteng banget gakuatttt enchella enhypen
GAK KUAT #HOONCELLA #SUNGHOON #ENCHELLA #ENCHELLA2025 #ENHYPEN #ENHYPEN_SUNGHOON;gak kuat hooncella sunghoon enchella enhypen enhypensunghoon
Kesenjangan skor makasih enhypen telah membuat ku good mood di pagi hari makasih Allah telah membuatku puas dengan hasilnya #ENHYPEN #ENCHELLA #ENCHELLA2025 #SUNGHOONRulesCoachella https://t.co/CqB1N2Xzkv;kesenjangan skor makasih enhypen ku good mood pagi allah membuatku puas hasilnya enchella sunghoonrulescoachella
bite me no backtrack sama sekali keren bgt kalian heyy #ENCHELLA #ENCHELLA2025 #ENHYPEN https://t.co/gnZZp1mhVL;bite me no backtrack keren bgt heyy enchella enhypen
OMG ENHYPEN COACHELLA WEEK2 DAH GADA OBAT GILAK MAKIN PECAH #ENCHELLA2025 #ENHYPEN #Coachella2025;omg enhypen coachella week dah gada obat gilak pecah enchella
JUJUR GUE NGAKAK BANGET INI YAALLAH SUNGHOON GUE KEBAKAR MAAP YA ENGENE GUE GAK SENGAJA SUER TERIMALAH PERMINTAAN MAAF DARI PACAR HEESEUNG INI #ENCHELLA2025 #ENHYPEN #SUNGHOON https://t.co/0Gco4dCtij;jujur gue ngakak banget yaallah sunghoon kebakar maap ya engene gak sengaja suer terimalah permintaan maaf pacar heeseung enchella enhypen
Belum ada 1 hari menghadapi jay 23 hybe curse udh mau meninggoy aja‍️‍️ #ENHYPEN_JAY #ENCHELLA2025;menghadapi jay hybe curse udh meninggoy aja enhypenjay enchella
PUTANGINAAAA ANG ANGAS NH COACHELLAAAABNSNSBJAKAOEIJEJWN #ENCHELLA #ENCHELLA2025;putanginaaaa ang angas nh coachellaaaabnsnsbjakaoeijejwn enchella
Teriakan Jay yang paling ditunggu!! COACHELLAAAAAAA!! #ENCHELLA2025 #HappyJayDay https://t.co/danYxJRvna;teriakan jay ditunggu coachellaaaaaaa enchella happyjayday
mereka tuh udah keren tp kalo concert live performance + mic on full energy dance a long itu kereen bangetttt. aku kehabisan kata² buat muji bujang² ini u guys so crazy i'm dead #ENCHELLA #ENHYPEN #ENCHELLA2025 https://t.co/zZsT0l9KKB;tuh udah keren tp kalo concert live performance mic on full energy dance a long kereen bangetttt kehabisan muji bujang u guys so crazy im dead enchella enhypen
Gila...rambutnya luntur sebadan Gantengnya gak ngotak dah nih anak... #HEESEUNG #ENHYPEN_HEESEUNG #ENCHELLA2025 #Coachella2025 https://t.co/fYOM40sT6e;gilarambutnya luntur sebadan gantengnya gak ngotak dah nih anak heeseung enhypenheeseung enchella coachella
DAH SUDAH CUKUP YA ALLAH #ENCHELLA #ENCHELLA2025 #ENHYPEN #Coachella2025 https://t.co/GCt420pN80;dah ya allah enchella enhypen coachella
Bahkan keringatnya aja warna pink he so sexy #HEESEUNG #ENHYPEN_HEESEUNG #ENCHELLA2025 #Coachella2025;keringatnya aja warna pink he so sexy heeseung enhypenheeseung enchella coachella
Oooo paham gw paham ama konsepnya ini inspired by walid keknya.. jadi kekasih batin gitu oke sip. #ENCHELLA2025 #ENHYPEN https://t.co/ox9mxp7urT;oooo paham gw ama konsepnya inspired by walid keknya kekasih batin gitu oke sip enchella enhypen
Paling ga bisa gua ngeliat jay rambut biasa kek gini ajdjaknsoahsoa ult bias wrecker bgt #ENHYPEN #ENHYPEN_JAY #ENCHELLA2025 #Coachella2025 https://t.co/H8QRIp4SJr;ga gua ngeliat jay rambut kek gini ajdjaknsoahsoa ult bias wrecker bgt enhypen enhypenjay enchella coachella
Galeri gua udh ga bisa di selamatkan lagi #ENHYPEN #ENCHELLA2025 #Coachella2025;galeri gua udh ga selamatkan enhypen enchella coachella
NIII-KIII #ENCHELLA #ENCHELLA2025 https://t.co/HadllnEYTm;niiikiii enchella
ni orang hobi bgt bikin stress engene #ENCHELLA #ENCHELLA2025 https://t.co/s9SC1UVpA1;ni orang hobi bgt bikin stress engene enchella
Aku juga mau di lopein riki️️️️️ #ENCHELLA2025;lopein riki enchella
MY SHAYLAAAAAA NUNU DEWASA KALOO PAKE HAIRCUT INI WOILAH #ENCHELLA2025 ;my shaylaaaaaa nunu dewasa kaloo pake haircut woilah enchella
JAKET MERAH GACOR EUYY️‍ #JAKE #ENHYPEN #ENCHELLA2025 https://t.co/7bxy58Nchy;jaket merah gacor euyy jake enhypen enchella
250419 Heeseung Smirk #ENCHELLA2025 #ENCHELLA #ENHYPEN #ENHYPEN_HEESEUNG #HEESEUNG #이희승 https://t.co/n4wwY3Iunu;heeseung smirk enchella enhypen enhypenheeseung
keren keren banget cowoku #ENCHELLA #ENHYPEN #ENCHELLA2025 https://t.co/bslbRXHpgA;keren banget cowoku enchella enhypen
bang sunghoon gacor bgt geloooo #ENCHELLA2025 https://t.co/BWrYOxT7wl;bang sunghoon gacor bgt geloooo enchella
Muahhhhhh #Coachella2025 #ENHYPEN #ENCHELLA2025 #HOONCHELLA;muahhhhhh coachella enhypen enchella hoonchella
#ENHYPEN #ENCHELLA2025 PECAH ;enhypen enchella pecah
3 oknum yang buat jantung gw gejedar gejeder di coachella hari ini apalagi heehoon yg awal² masih pake jaket tp tiba-tiba??? jaketnya dibuka WTF!!!!! ️‍️‍️‍️‍️‍️‍️‍️‍️‍️‍️‍ #Coachella2025 #ENCHELLA2025 https://t.co/70T49Y71Yl;oknum jantung gw gejedar gejeder coachella heehoon yg pake jaket tp tibatiba jaketnya dibuka wtf enchella
@depresslay hai apkh km baik2 sj abis liat #ENCHELLA2025 https://t.co/mBEPcOvEKN;hai apkh km sj abis liat enchella
THIS PARTTTTTTT selalu membuat gue sintinggg....kayak....gatau knp setiap sweet venom part sunghoon yg enih bikin gue ga waras cakeppp bgtcuriga tatapan dia mengandung pelet ikan koi #ENCHELLA2025 #ENCHELLA https://t.co/Y7FTaDXsM1;this parttttttt gue sintingggkayakgatau knp sweet venom part sunghoon yg enih bikin ga waras cakeppp bgtcuriga tatapan mengandung pelet ikan koi enchella
jatuh cinta banget sama jake di week 2 ‍️ #Coachella2025 #ENCHELLA2025;jatuh cinta banget jake week coachella enchella
NISHIMURA RIKI #ENHYPEN_NI_KI #ENCHELLA2025 #Coachella2025 https://t.co/kpkbzOCWiY;nishimura riki enhypenniki enchella coachella
SUNGHOON DITINGGAL MELENG DIKIT UDH LEPAS JAKETTT #SUNGHOON #ENCHELLA #HOONCHELLA #ENHYPEN #ENCHELLA2025 https://t.co/A0GaY2iKQN;sunghoon ditinggal meleng dikit udh lepas jakettt enchella hoonchella enhypen
SHIBALLL SI JAKET MERAHH INI BIKIN GILAAA #Coachella2025 #ENHYPEN #ENCHELLA2025 #JAKE https://t.co/AmszRvryPZ;shiballl si jaket merahh bikin gilaaa coachella enhypen enchella jake
aku sayang jungwon #ENHYPEN #ENCHELLA2025 https://t.co/YmHWeRQ29B;sayang jungwon enhypen enchella
ini konsepnya demo mahasiswa #ENCHELLA2025 #enchella #ENCHELLA #ENHYPEN #CHOACHELLA #Choachella2025 https://t.co/zhjI7dqYtN;konsepnya demo mahasiswa enchella enhypen choachella
Sunghoon dari makek Jaket sampek lepas Jaket cakepnya malah meningkat YA ALLAAAHHH #ENHYPEN #ENCHELLA2025 https://t.co/77uwvnA92d;sunghoon makek jaket sampek lepas cakepnya meningkat ya allaaahhh enhypen enchella
THE HAIR STYLE THE OUTFIT....‍️‍️ NI-KI ANAK AYAMKU DAH BERUBAH JADI PUMA ༎ຶ⁠‿⁠༎ຶ ENHYPEN VAMPS UP COACHELLA #ENHYPENinCoachella #ENCHELLA2025 #COACHELLA https://t.co/JwCgwSbE1Q;the hair style outfit niki anak ayamku dah berubah puma enhypen vamps up coachella enhypenincoachella enchella
mama: ini yang paling ganteng ini me as a proud gf: #ENCHELLA2025 https://t.co/wg8ccl5kce;mama ganteng me as a proud gf enchella
NI-KI KITA TUH SEUMURAN PELISSSSS JANGAN KEREN² ENHYPEN VAMPS UP COACHELLA #ENHYPENinCoachella #ENCHELLA2025 #COACHELLA https://t.co/QEjrw83zFd;niki tuh seumuran pelisssss keren enhypen vamps up coachella enhypenincoachella enchella
GA BOONG INII BENERAN MAHH si Jake SUNOO sama Sunghoon BENER BENER CAKEPP BANGETT DI WEEK 2 INII KAYAKK AURA MEREKA TUHH KELUAR BGTT GITUU LOHH +10000000000000000000 AURAA #ENHYPEN #ENCHELLA2025 #COACHELLA2025 https://t.co/G4cVVSFSY6;ga boong inii beneran mahh si jake sunoo sunghoon bener cakepp bangett week kayakk aura tuhh bgtt gituu lohh auraa enhypen enchella coachella
sayang #JUNGWON #ENHYPEN #ENCHELLA2025 https://t.co/Hozxm0DIO2;sayang jungwon enhypen enchella
Gacor abisss parahh mau nangis rasanya pada keren banget huhu ENHYPEN WE'RE SO PROUD OF YOU!! #ENHYPEN #ENCHELLA2025 #enchella #Coachella2025 https://t.co/fUDx8rTcEz;gacor abisss parahh nangis keren banget huhu enhypen were so proud of you enchella coachella
SIAPKAN UANG KALIAN MARI KITA EXCITED BUAT CB KALI INI #ENHYPEN #ENCHELLA #ENCHELLA2025 https://t.co/KWeU6mbFSH;siapkan uang mari excited cb kali enhypen enchella
Heeseung hari ini centil bangett target nya sapa nih hee #HEESEUNG #ENCHELLA2025 https://t.co/9qqzONXqQW;heeseung centil bangett target nya sapa nih hee enchella
#Coachella2025 #ENCHELLA2025 #ENHYPEN gilaa!! keren bgt Enhypen kece bgt kalian proud of you guys!! https://t.co/XTUxysRrmf;coachella enchella enhypen gilaa keren bgt kece proud of you guys
seGILA ini ak........... #ENCHELLA2025 https://t.co/o8AA7uGX2o;segila ak enchella
DAMNNNNN REFLEK BERLUTUT ‍️‍️‍️‍️‍️‍️‍️ #SUNGHOON #ENHYPEN #ENCHELLA2025 #Coachella2025 https://t.co/Lf81sjqO02;damnnnnn reflek berlutut sunghoon enhypen enchella coachella
@stbjwn jungcat #ENCHELLA #ENHYPEN #ENCHELLA2025;jungcat enchella enhypen
Ini mah gw NAKSIRRR BGT DEKKK SUNOO REIGNS COACHELLA #SUNOO #선우 #ENCHELLA2025;mah gw naksirrr bgt dekkk sunoo reigns coachella enchella
Keluar Kodam gue #ENCHELLA #ENCHELLA2025 #ENHYPEN #Coachella #Coachella2025 #HEESEUNG #heeseung #JAY #jay #JAKE #jake #SUNGHOON #sunghoon #SUNOO #sunoo #JUNGWON #jungwon #NI_KI #ni_ki https://t.co/Q0ulHKs6OH;kodam gue enchella enhypen coachella heeseung jay jake sunghoon sunoo jungwon niki
Go engene we go! Ga ga ga ga ga #ENCHELLA2025 #Coachella2025 #ENHYPEN #ENHYPEN_members https://t.co/qmKrfc4XMQ;go engene we ga enchella coachella enhypen enhypenmembers
spill reaksi kalian liat enchella week 2 guysss #ENCHELLA2025 #Coachella2025 #ENHYPEN;spill reaksi liat enchella week guysss coachella enhypen
Opening di sambut beginian #ENHYPEN #ENCHELLA2025 https://t.co/ggR86lAQEV;opening sambut enhypen enchella
#ENCHELLA2025 Keren bgt asli sampe nangis hikz dulu di i-land cimit banget sekarang udah di Coachella. Apalagi di heeseung itu hobi banget nambah istri. Sehari aja dia ngga menggoda kayanya meriang deh. #ENHYPEN #Coachella2025 #ENCHELLA2025;enchella keren bgt asli sampe nangis hikz iland cimit banget udah coachella heeseung hobi nambah istri sehari aja ngga menggoda kayanya meriang deh enhypen
SUNGHOON MAAF AKUUU OLENG KE JAY️ ENHYPEN VAMPS UP COACHELLA #ENHYPENinCoachella #ENCHELLA2025 #COACHELLA https://t.co/aMnpNcJthD;sunghoon maaf akuuu oleng jay enhypen vamps up coachella enhypenincoachella enchella
GILAAAAA GUE KEK LANGSUNG TERIAK PAS LIAT INI. AKSJSISJDK GK SABARRRRR #ENHYPEN #ENCHELLA2025 https://t.co/jgl3WrSWjE;gilaaaaa gue kek langsung teriak pas liat aksjsisjdk gk sabarrrrr enhypen enchella
seriusan ni udah abiss??? #ENCHELLA2025 #Coachella2025 #ENHYPEN;seriusan ni udah abiss enchella coachella enhypen
MOONSTRUCK ENHYPEN #ENHYPEN #ENCHELLA2025 #ENCHELLA #Coachella2025 #JUNGWON #HEESEUNG JAY SUNGHOON SUNOO NIKI JAKE https://t.co/pYmTKYRQgI;moonstruck enhypen enchella coachella jungwon heeseung jay sunghoon sunoo niki jake
GILA KALI YA HUEUEUUEUE HOONIE TODAY GILA BANGET ANJIRRRR #SUNGHOON #ENHYPEN #ENCHELLA2025 #Coachella2025 https://t.co/UJ7pVIY5Lk;gila kali ya hueueuueue hoonie today banget anjirrrr sunghoon enhypen enchella coachella
Panas banget ini #ENCHELLA2025 gara2 #ENHYPEN_JAKE https://t.co/CtPf66KjvL;panas banget enchella gara enhypenjake
ASEK BTUL #ENHYPEN #Coachella #ENCHELLA2025 https://t.co/4DTdp0fERH;asek btul enhypen coachella enchella
mengosongkan memori hp untuk mengsave foto enchella week 2 kemudian #ENCHELLA2025 #enchella #ENHYPEN;mengosongkan memori hp mengsave foto enchella week enhypen
GAK SABAR BANGET !!!! ENHYPEN VAMPS UP COACHELLA #ENCHELLA2025 https://t.co/YMwYsrtwT5;gak sabar banget enhypen vamps up coachella enchella
HAPPY BIRTHDAY SA ASAWA NG ASAWA KO #ENHYPEN #ENCHELLA #ENCHELLA2025 https://t.co/A3H9QNmjLa;happy birthday sa asawa ng ko enhypen enchella
Enhypen nggak kerasa amat dah selesai aja T__T #Coachella2025 #ENCHELLA #ENCHELLA2025 #ENHYPEN;enhypen nggak kerasa dah selesai aja tt coachella enchella
PARAH BANGET EMG ENHA INI YA TUHAN AKU SAYANG ENHYPEENNN I LOVEE YOUUU #ENCHELLA2025 https://t.co/tM1H8l1NnR;parah banget emg enha ya tuhan sayang enhypeennn i lovee youuu enchella
selir sunghoon nambah semilyar ENHYPEN VAMPS UP COACHELLA #ENHYPENinCoachella #ENCHELLA2025 #COACHELLA https://t.co/7PDHQT8pk6;selir sunghoon nambah semilyar enhypen vamps up coachella enhypenincoachella enchella
YUNG MURA NI JAKE #ENCHELLA #ENHYPEN #ENHYPEN_JAKE #ENCHELLA2025;yung mura ni jake enchella enhypen enhypenjake
PENGUMUMAN COMEBACK TERKEREN TERGACOR TAHUN INI!!! @ENHYPEN #ENCHELLA #ENCHELLA2025 #ENHYPEN https://t.co/Bj6MyiRiCO;pengumuman comeback terkeren tergacor enchella enhypen
OKEY LET'S GAURRR FINALLY THE PERFORMANCE IT'S END DAN TUGAS KITA SEKARANG SEBAGAI ENGENE ADALAH NAIKIN HT MEREKA YOK SEMANGAT #ENHYPEN #ENCHELLA #Coachella2025 #ENCHELLA2025 https://t.co/IA8jSgXCa2;okey lets gaurrr finally the performance its end tugas engene naikin ht yok semangat enhypen enchella coachella
UDAH YA HOTSPOTNYA AKU MATIIN #ENCHELLA #ENCHELLA2025 #Coachella2025 https://t.co/fD5mwujtiE;udah ya hotspotnya matiin enchella coachella
HEESEUNG SUNGHOON GEBRAKANNYA AKU GA KUWATTT ENHYPEN VAMPS UP COACHELLA #ENHYPENinCoachella #ENCHELLA2025 #COACHELLA;heeseung sunghoon gebrakannya ga kuwattt enhypen vamps up coachella enhypenincoachella enchella
SOBRANG GALING NG ENHA EUUEUEUEUEE NAIIYAK AK ENHYPEN VAMPS UP COACHELLA #ENHYPENinCoachella #ENCHELLA2025 #COACHELLA;sobrang galing ng enha euueueueuee naiiyak ak enhypen vamps up coachella enhypenincoachella enchella
Baru pas bagian reflek bilang 'HAH' fixx ini album buat next comeback enhypen ENHYPEN VAMPS UP COACHELLA #ENHYPENinCoachella #ENCHELLA2025 #COACHELLA https://t.co/6lTfbwmeEP;pas reflek bilang hah fixx album next comeback enhypen vamps up coachella enhypenincoachella enchella
BAGUS JAKETNYA DI LEPASS AKU GAPAPA GUYS‍️ #ENHYPENinCoachella #ENCHELLA2025 #COACHELLA https://t.co/4AQ25zJcOf;bagus jaketnya lepass gapapa guys enhypenincoachella enchella coachella
engene pas ending td nyanyiii happy bdaayy jayy ENHYPEN VAMPS UP COACHELLA #ENHYPENinCoachella #ENCHELLA2025 #COACHELLA https://t.co/he3hcFQcKC;engene pas ending td nyanyiii happy bdaayy jayy enhypen vamps up coachella enhypenincoachella enchella
KIM SUNOO JIDATAN IS SUPERIOR ‍‍ SELIR KIM SUNOO NAMBAH 5 JUTA #ENCHELLA #ENCHELLA2025 https://t.co/8vf3pgWJBJ;kim sunoo jidatan is superior selir nambah juta enchella
HEESEUNG YAK TEBAR PESONA BGT AURA NYA AUR AURAN #ENHYPEN #ENCHELLA #ENCHELLA2025;heeseung yak tebar pesona bgt aura nya aur auran enhypen enchella
PAS BAGIAN INI MUNCUL KUKIRA BUAT NEXT LINE UP TAMPIL ENHYPEN VAMPS UP COACHELLA #ENHYPENinCoachella #ENCHELLA2025 #COACHELLA https://t.co/dITheong91;pas muncul kukira next line up tampil enhypen vamps coachella enhypenincoachella enchella
SUKA BANGET SAMA RAMBUT+ OUTFIT SUNGJAKE ENHYPEN VAMPS UP COACHELLA #ENHYPENinCoachella #ENCHELLA2025 #COACHELLA;suka banget rambut outfit sungjake enhypen vamps up coachella enhypenincoachella enchella
DRUNK DAZED LAGUNYA KYK LAGU DUGEM KOCAKK #ENCHELLA2025;drunk dazed lagunya kyk lagu dugem kocakk enchella
OTOT NYA SUNGHOON YAALLAH ITU BISA MENAMPUNG BEBAN HIDUP SKRIPSI GUEE #ENCHELLA2025;otot nya sunghoon yaallah menampung beban hidup skripsi guee enchella
SSUNGHOON JAKET LU KMN HEH #ENCHELLA2025;ssunghoon jaket lu kmn heh enchella
Heeseung gila bangettttt ENHYPEN VAMPS UP COACHELLA #ENHYPENinCoachella #ENCHELLA2025 #COACHELLA;heeseung gila bangettttt enhypen vamps up coachella enhypenincoachella enchella
DITINGGAL BNTR KOK ELU JD BGINI HOON ENHYPEN VAMPS UP COACHELLA #ENHYPENinCoachella #ENCHELLA2025 #COACHELLA https://t.co/rqBD2ZRqb0;ditinggal bntr elu jd bgini hoon enhypen vamps up coachella enhypenincoachella enchella
ril merah juga keringetnya heeseung #enchella2025 https://t.co/O2g1EmFB9w;ril merah keringetnya heeseung enchella
PARK SUNGHOON LU BENER BENER YA ENHYPEN VAMPS UP COACHELLA #ENHYPENinCoachella #ENCHELLA2025 #COACHELLA;park sunghoon lu bener ya enhypen vamps up coachella enhypenincoachella enchella
Keringetnya heeseung merah... pake nail polish jugaa dammn ENHYPEN VAMPS UP COACHELLA #ENHYPENinCoachella #ENCHELLA2025 #COACHELLA;keringetnya heeseung merah pake nail polish jugaa dammn enhypen vamps up coachella enhypenincoachella enchella
selalu keren guys️‍️‍ #ENCHELLA2025;keren guys enchella
aduhh sunghoooon sopankahhh lepas jakettt pas moonstruck #ENHYPENinCoachella #ENCHELLA2025 #COACHELLA;aduhh sunghoooon sopankahhh lepas jakettt pas moonstruck enhypenincoachella enchella coachella
Ihh harus denger nih Jay ENHYPEN VAMPS UP COACHELLA #ENHYPENinCoachella #ENCHELLA2025 #COACHELLA;ihh denger nih jay enhypen vamps up coachella enhypenincoachella enchella
GW UDAH GA BERNYAWA ABIS DAYDREAM INI TOLONG #ENCHELLA2025;gw udah ga bernyawa abis daydream tolong enchella
ANG LAKAS NA NG CROWD AH! EWAN NALANG TALAGA KUNG MAY MASABI PA YUNG IBA #ENCHELLA2025;ang lakas na ng crowd ah ewan nalang talaga kung may masabi pa yung iba enchella
AWA NALAMH HEESEUNG ENHYPEN VAMPS UP COACHELLA #ENHYPENinCoachella #ENCHELLA2025 #COACHELLA;awa nalamh heeseung enhypen vamps up coachella enhypenincoachella enchella
SOBRANG GALING TLGA #ENCHELLA2025 #ENHYPEN;sobrang galing tlga enchella enhypen
JUNGWON LAP KERINGETNYA HISENG?!! #ENHYPEN #ENCHELLA2025 #ENCHELLA;jungwon lap keringetnya hiseng enhypen enchella
Wtb record file konser-konser atau fanmeet online enhypen dong Ayo tawarkan kepadaku gaes #wtb #zonauang #enhypen #ENCHELLA2025;wtb record file konserkonser fanmeet online enhypen ayo tawarkan kepadaku gaes zonauang enchella
OMG SUNGHOON #ENCHELLA2025;omg sunghoon enchella
sunghoon do ceu ...... #ENCHELLA2025 #ENCHELLA #ENHYPEN;sunghoon do ceu enchella enhypen
okay.... setlist nya sm tp boleh ga nambah ada shout out sm fever nya #ENHYPEN #ENCHELLA2025;okay setlist nya sm tp ga nambah shout out fever enhypen enchella
baliw na baliw sau sunghoon putainah! ENHYPEN VAMPS UP COACHELLA #ENCHELLA2025 #ENHYPEN #COACHELLA2025;baliw na sau sunghoon putainah enhypen vamps up coachella enchella
lakas ng genes ni mingyu e HAHAHAHAH #ENCHELLA2025;lakas ng genes ni mingyu e hahahahah enchella
SOPAN LUUU BEGITU KIM SUNOO????? ENHYPEN VAMPS UP COACHELLA #ENHYPENinCoachella #ENCHELLA2025 #COACHELLA;sopan luuu kim sunoo enhypen vamps up coachella enhypenincoachella enchella
Seung maaf Seung rambutmu lunturr #ENHYPENinCoachella #ENCHELLA2025 #COACHELLA;seung maaf rambutmu lunturr enhypenincoachella enchella coachella
HEESUN RISNDUMSGDKSHD #ENHYPENinCoachella #ENCHELLA2025 #COACHELLA;heesun risndumsgdkshd enhypenincoachella enchella coachella
salting bgt tlong mmh ENHYPEN VAMPS UP COACHELLA #ENHYPENinCoachella #ENCHELLA2025 #COACHELLA https://t.co/krcgOR9qcV;salting bgt tlong mmh enhypen vamps up coachella enhypenincoachella enchella
salting bgt ak park sungun ENHYPEN VAMPS UP COACHELLA #ENHYPENinCoachella #ENCHELLA2025 #COACHELLA;salting bgt ak park sungun enhypen vamps up coachella enhypenincoachella enchella
moots NI DUA ORANG CAKEP BGT GILEEEE BJIRR #ENCHELLA2025 #ENCHELLA #ENHYPEN #ENHYPEN_JAY #ENHYPEN_SUNGHOON https://t.co/5uHQB1scty;moots ni orang cakep bgt gileeee bjirr enchella enhypen enhypenjay enhypensunghoon
